Category,Sub Catagory,Type,Brand,product,Product Description,Price,Tax,Image,Store,Size,UOM,Spice Level,Aisle No.
Cooking Needs,Canned Food,Canned & Jarred Vegetables,Del Monte,Del Monte Diced Tomatoes Diced with the Flavors of Basil Garlic & Oregano,,1.29,0,5028.jpg,,14.5,oz,,9
Cooking Needs,Canned Food,Canned & Jarred Vegetables,Del Monte,"Del Monte Diced with Basil, Garlic & Oregano Tomatoes",,1.29,0,5034.jpg,,14.5,oz,,9
Cooking Needs,Canned Food,Canned & Jarred Vegetables,Del Monte,Del Monte Harvest Selects Peas & Carrots,,0.99,0,5022.jpg,,8.5,oz,,9
Cooking Needs,Canned Food,Canned & Jarred Vegetables,Del Monte,Del Monte Leaf Spinach,,1.09,0,5027.jpg,,13.5,oz,,9
Cooking Needs,Canned Food,Canned & Jarred Vegetables,Del Monte,"Del Monte Original Recipe Stewed Tomatoes with Onions, Celery & Green Peppers",,1.29,0,5030.jpg,,14.5,oz,,9
Cooking Needs,Canned Food,Canned & Jarred Vegetables,Del Monte,Del Monte Petite Cut Diced Hot with Jalapeno & Habanero Tomatoes,,1.29,0,5020.jpg,,14.5,oz,,9
Cooking Needs,Canned Food,Canned & Jarred Vegetables,Del Monte,Del Monte Petite Cut Diced No Salt Added Tomatoes,,1.29,0,5037.jpg,,14.5,oz,,9
Cooking Needs,Canned Food,Canned & Jarred Vegetables,Del Monte,Del Monte Sliced Carrots,,1.09,0,5023.jpg,,14.5,oz,,9
Cooking Needs,Canned Food,Canned & Jarred Vegetables,Del Monte,Del Monte Stewed Tomatoes No Salt Added,,1.29,0,5031.jpg,,14.5,oz,,9
Cooking Needs,Canned Food,Canned & Jarred Vegetables,Del Monte,"Del Monte Tomatoes, Diced with Zesty Mild Green Chiles",,2.09,0,5036.jpg,,14.5,oz,,9
Cooking Needs,Canned Food,Canned & Jarred Vegetables,Del Monte,Del Monte Whole Kernel Corn,,1.09,0,5017.jpg,,15.25,oz,,9
Cooking Needs,Canned Food,Canned & Jarred Vegetables,Del Monte,Del Monte Whole Kernel Corn,,0.99,0,5018.jpg,,8.75,oz,,9
Cooking Needs,Canned Food,Canned & Jarred Vegetables,Del Monte,Del Monte Whole Kernel Corn,,1.09,0,5035.jpg,,15.25,oz,,9
Cooking Needs,Canned Food,Canned & Jarred Vegetables,Del Monte,Del Monte Zucchini With Italian Style Tomato Sauce,,1.89,0,5025.jpg,,14.5,oz,,9
Cooking Needs,Canned Food,Canned & Jarred Vegetables,El Jibarito,"El Jibarito Pigeon Peas, Can",,1.49,0,17101.jpg,,15.5,oz,,9
Cooking Needs,Canned Food,Canned & Jarred Vegetables,Del Monte,Del Monte Fresh Cut French Style Green Beans,,1.09,0,5019.jpg,,14.5,oz,,9
Cooking Needs,Canned Food,Canned & Jarred Vegetables,Del Monte,Del Monte Fresh Cut Golden Corn Sweet Cream Style,,1.09,0,5029.jpg,,14.75,oz,,9
Cooking Needs,Canned Food,Canned & Jarred Vegetables,Del Monte,Del Monte Fresh Cut Golden Sweet Corn Cream Style No Salt Added,,1.09,0,5038.jpg,,14.75,oz,,9
Cooking Needs,Canned Food,Canned & Jarred Vegetables,Del Monte,Del Monte Fresh Cut Golden Sweet No Salt Added Whole Kernel Corn,,0.99,0,5033.jpg,,8.75,oz,,9
Cooking Needs,Canned Food,Canned & Jarred Vegetables,Del Monte,Del Monte Fresh Cut Sliced Carrots,,0.99,0,5026.jpg,,8.25,oz,,9
Cooking Needs,Canned Food,Canned & Jarred Vegetables,Del Monte,Del Monte Fresh Cut Sweet Peas,,1.09,0,5021.jpg,,15,oz,,9
Cooking Needs,Canned Food,Canned & Jarred Vegetables,Del Monte,Del Monte Fresh Cut Sweet Peas,,0.99,0,5024.jpg,,8.5,oz,,9
Cooking Needs,Canned Food,Canned & Jarred Vegetables,Del Monte,Del Monte Harvest Selects Fresh Cut Gold & White Corn Whole Kernel Sweet,,1.89,0,5039.jpg,,15.25,oz,,9
Cooking Needs,Canned Food,Canned & Jarred Vegetables,Del Monte,Fresh Cut Del Monte Sliced Beets,,0.99,0,17080.jpg,,8.25,oz,,9
Cooking Needs,Canned Food,Canned & Jarred Vegetables,Pomi,Pomi Chopped Tomatoes 100% Fresh Italian,,2.49,0,17098.jpg,,26,oz,,9
Cooking Needs,Canned Food,Canned & Jarred Vegetables,Gefen,Gefen Cucumbers In Brine,,3.09,0,17081.jpg,,19,oz,,9
Cooking Needs,Canned Food,Canned & Jarred Vegetables,Gonsalves,Gonsalves Sliced Sweet Red Peppers,,4.19,0,No Image.jpg,,1,oz,,9
Cooking Needs,Canned Food,Canned & Jarred Vegetables,Goya,Goya Whole Tomatillos,,2.69,0,No Image.jpg,,26,oz,,9
Cooking Needs,Canned Food,Canned & Jarred Vegetables,Green Giant,Green Giant Steam Crisps Corn Niblets,,1.09,0,5084.jpg,,11,oz,,9
Cooking Needs,Canned Food,Canned & Jarred Vegetables,Green Giant,Green Giant SteamCrisp Niblets Whole Kernel Sweet Corn,,1.09,0,5087.jpg,,11,oz,,9
Cooking Needs,Canned Food,Canned & Jarred Vegetables,Green Giant,Green Giant SteamCrisp Super Sweet Yellow & White Whole Kernel Corn,,1.89,0,5083.jpg,,11,oz,,9
Cooking Needs,Canned Food,Canned & Jarred Vegetables,Green Giant,Green Giant SteamCrisp White Shoepeg Whole Kernel Corn,,1.89,0,5086.jpg,,11,oz,,9
Cooking Needs,Canned Food,Canned & Jarred Vegetables,Green Giant,Green Giant Vacuum Packed Crisp Niblets,,0.99,0,5085.jpg,,7,oz,,9
Cooking Needs,Canned Food,Canned & Jarred Vegetables,Hunt's,Hunt's Choice Cut Diced Tomatoes,,1.29,0,4996.jpg,,14.5,oz,,9
Cooking Needs,Canned Food,Canned & Jarred Vegetables,Hunt's,Hunt's Choice Cut Diced Tomatoes With Basil Garlic And Oregano,,1.89,0,5011.jpg,,28,oz,,9
Cooking Needs,Canned Food,Canned & Jarred Vegetables,Hunt's,Hunt's Choice Cut Diced Tomatoes With Roasted Garlic,,0.99,0,5005.jpg,,14.5,oz,,9
Cooking Needs,Canned Food,Canned & Jarred Vegetables,Hunt's,Hunt's Crushed Tomatoes,,1.89,0,4999.jpg,,28,oz,,9
Cooking Needs,Canned Food,Canned & Jarred Vegetables,Hunt's,Hunt's Crushed Tomatoes With Basil,,1.89,0,5015.jpg,,28,oz,,9
Cooking Needs,Condiments & Sauces,Condiments,Ba-Tampte,Ba Tampte Horseradish,,2.49,0,15358.jpg,,8,oz,,2
Cooking Needs,Condiments & Sauces,Condiments,Ba-Tampte,Ba Tampte Prepared Horseradish & Beets,,2.49,0,15367.jpg,,8,oz,,2
Cooking Needs,Condiments & Sauces,Condiments,Bookbinder's,Bookbinder's Creamy Horseradish Sauce Sassy,,3.69,0,15387.jpg,,9.5,oz,,2
Cooking Needs,Condiments & Sauces,Condiments,Bookbinder's,Bookbinder's Horseradish Prepared,,3.69,0,15360.jpg,,9.75,oz,,2
Cooking Needs,Condiments & Sauces,Condiments,Bookbinder's,Bookbinder's Wasabi Sauce Hot,,3.69,0,15380.jpg,,9.5,oz,,2
Cooking Needs,Condiments & Sauces,Condiments,Cains,Cains Light mayonnaise,,2.49,0,1566.jpg,,30,fl oz,,2
Cooking Needs,Condiments & Sauces,Condiments,Cains,Cains Mayonnaise,,3.69,0,1562.jpg,,15,fl oz,,2
Cooking Needs,Condiments & Sauces,Condiments,Cains,Cains Mayonnaise,,4.89,0,1564.jpg,,30,fl oz,,2
Cooking Needs,Condiments & Sauces,Condiments,Cains,Cains Old Fashioned Sweet Relish,,2.49,0,1565.jpg,,16,fl oz,,2
Cooking Needs,Condiments & Sauces,Condiments,Lavant,Lavant Tahina,,3.09,0,No Image.jpg,,16,oz,,2
Cooking Needs,Condiments & Sauces,Condiments,Lea & Perrins,Lea & Perrins Original Worcestershire Sauce,,3.69,0,No Image.jpg,,15,oz,,2
Cooking Needs,Condiments & Sauces,Condiments,Lea & Perrins,Lea & Perrins The Original Worcestershire Sauce,,4.89,0,15349.jpg,,15,fl oz,,2
Cooking Needs,Condiments & Sauces,Condiments,Louisiana,Louisiana The Original Perfect Hot Sauce,,1.29,0,15356.jpg,,6,fl oz,,2
Cooking Needs,Condiments & Sauces,Condiments,Maille,Maille Mustard Dijon Originale,,3.69,0,15371.jpg,,7.5,oz,,2
Cooking Needs,Condiments & Sauces,Condiments,Maille,Maille Mustard Honey Dijon,,4.69,0,15386.jpg,,8.1,oz,,2
Cooking Needs,Condiments & Sauces,Condiments,Maille,Maille Mustard Old Style,,4.69,0,15382.jpg,,7.3,oz,,2
Cooking Needs,Condiments & Sauces,Condiments,Market Basket,Market Basket Chili Sauce,,1.69,0,Market Basket.jpg,,12,oz,,2
Cooking Needs,Condiments & Sauces,Condiments,Market Basket,Market Basket Cocktail Sauce,,1.69,0,Market Basket.jpg,,12,oz,,2
Cooking Needs,Condiments & Sauces,Condiments,Market Basket,Market Basket Honey Barbecue Sauce,,1.59,0,Market Basket.jpg,,1,ct,,2
Cooking Needs,Condiments & Sauces,Condiments,Market Basket,Market Basket Honey Mustard,,1.49,0,Market Basket.jpg,,12,oz,,2
Cooking Needs,Condiments & Sauces,Condiments,Market Basket,Market Basket Horseradish Mustard,,1.09,0,Market Basket.jpg,,12,oz,,2
Cooking Needs,Condiments & Sauces,Condiments,Market Basket,Market Basket Hot Dog Relish,,1.59,0,Market Basket.jpg,,10,oz,,2
Cooking Needs,Condiments & Sauces,Condiments,Market Basket,Market Basket Hot Sauce,,1.29,0,Market Basket.jpg,,12,fl oz,,2
Cooking Needs,Condiments & Sauces,Condiments,Market Basket,Market Basket Light Mayo,,1.69,0,Market Basket.jpg,,15,oz,,2
Cooking Needs,Condiments & Sauces,Condiments,Market Basket,Market Basket Light Reduced Calorie Mayonnaise,,2.69,0,Market Basket.jpg,,30,fl oz,,2
Cooking Needs,Condiments & Sauces,Condiments,Market Basket,Market Basket Mayonnaise,,2.69,0,Market Basket.jpg,,32,fl oz,,2
Cooking Needs,Condiments & Sauces,Condiments,Market Basket,Market Basket Mustard,,1.29,0,Market Basket.jpg,,24,oz,,2
Cooking Needs,Condiments & Sauces,Condiments,Market Basket,Market Basket Mustard,,1.49,0,Market Basket.jpg,,1,ct,,2
Cooking Needs,Condiments & Sauces,Condiments,Market Basket,Market Basket Mustard,,1.89,0,Market Basket.jpg,,8,oz,,2
Cooking Needs,Condiments & Sauces,Condiments,Market Basket,Market Basket Mustard Relish,,1.59,0,Market Basket.jpg,,9,fl oz,,2
Cooking Needs,Condiments & Sauces,Condiments,Market Basket,Market Basket Spicy Brown Mustard,,1.09,0,Market Basket.jpg,,12,oz,,2
Cooking Needs,Condiments & Sauces,Condiments,Market Basket,Market Basket Squeezable Mayonnaise,,1.89,0,Market Basket.jpg,,12,fl oz,,2
Cooking Needs,Condiments & Sauces,Condiments,Market Basket,Market Basket Sweet Relish,,1.89,0,Market Basket.jpg,,16,fl oz,,2
Cooking Needs,Condiments & Sauces,Condiments,Market Basket,Market Basket Sweet Relish,,1.59,0,Market Basket.jpg,,10,fl oz,,2
Cooking Needs,Condiments & Sauces,Condiments,Market Basket,Market Basket Tomato Ketchup,,1.29,0,Market Basket.jpg,,24,oz,,2
Cooking Needs,Condiments & Sauces,Condiments,Market Basket,Market Basket Tomato Ketchup,,1.29,0,Market Basket.jpg,,24,oz,,2
Cooking Needs,Condiments & Sauces,Condiments,Market Basket,Market Basket Tomato Ketchup,,3.09,0,Market Basket.jpg,,64,oz,,2
Cooking Needs,Condiments & Sauces,Condiments,Market Basket,Market Basket Traditional Yellow Mustard,,0.99,0,Market Basket.jpg,,14,oz,,2
Cooking Needs,Condiments & Sauces,Condiments,Market Basket,Market Basket Worcestershire Sauce,,1.29,0,Market Basket.jpg,,10,fl oz,,2
Cooking Needs,Condiments & Sauces,Condiments,Market Basket,Mayonnaise,,1.89,0,Market Basket.jpg,,1,ct,,2
Cooking Needs,Condiments & Sauces,Condiments,McCormick,McCormick Golden Dipt Seafood Cocktail Sauce,,2.49,0,15364.jpg,,8,fl oz,,2
Cooking Needs,Condiments & Sauces,Condiments,Mt. Olive,Mt. Olive Deli Style Dill Relish,,1.89,0,15352.jpg,,16,fl oz,,2
Cooking Needs,Condiments & Sauces,Condiments,Mt. Olive,Mt. Olive Deli Style Sweet Relish,,3.19,0,15365.jpg,,16,fl oz,,2
Cooking Needs,Condiments & Sauces,Condiments,Newman's Own,Newman's Own Mild Salsa,,3.09,0,15378.jpg,,16,oz,,2
Cooking Needs,Condiments & Sauces,Condiments,Ortega,Ortega Taco Sauce Original Thick & Smooth Medium,,1.89,0,15350.jpg,,8,oz,,2
Cooking Needs,Condiments & Sauces,Condiments,Ortega,Ortega Taco Sauce Original Thick & Smooth Mild,,1.89,0,15375.jpg,,8,oz,,2
Cooking Needs,Condiments & Sauces,Condiments,Oscar Mayer,Oscar Mayer Organic Yellow Mustard,,2.49,0,15372.jpg,,8,oz,,2
Cooking Needs,Condiments & Sauces,Condiments,Reese,Reese Prepared Horseradish,,3.29,0,15369.jpg,,6.5,oz,,2
Cooking Needs,Condiments & Sauces,Condiments,Sesame King,Sesame King Roasted Tahini,,3.69,0,17959.jpg,,16,oz,,2
Cooking Needs,Condiments & Sauces,Condiments,Smart Balance,Smart Balance Mayo Light Mayonnaise,,4.29,0,15366.jpg,,32,fl oz,,2
Cooking Needs,Condiments & Sauces,Condiments,Spectrum,Spectrum Organic Mayonnaise,,7.09,0,15389.jpg,,16,oz,,2
Cooking Needs,Condiments & Sauces,Condiments,Tabasco,Tabasco Green Pepper Sauce,,1.69,0,1584.jpg,,2,fl oz,,2
Cooking Needs,Condiments & Sauces,Condiments,Tabasco,Tabasco Original Flavor Pepper Sauce,,6.09,0,1585.jpg,,12,fl oz,,2
Cooking Needs,Condiments & Sauces,Condiments,Tabasco,Tabasco Pepper Sauce,,3.69,0,1583.jpg,,5,oz,,2
Cooking Needs,Condiments & Sauces,Condiments,Tabasco,Tabasco Pepper Sauce,,1.69,0,No Image.jpg,,2,oz,,2
Cooking Needs,Condiments & Sauces,Condiments,Tabasco,Tabasco Pepper Sauce Original,,1.69,0,1582.jpg,,2,fl oz,,2
Cooking Needs,Condiments & Sauces,Condiments,Walden Farms,"Walden Farms Ketchup, Calorie Free",,3.09,0,15348.jpg,,12,oz,,2
Cooking Needs,Condiments & Sauces,Condiments,Wickles,Wickles Relish,,3.69,0,15377.jpg,,16,fl oz,,2
Cooking Needs,Condiments & Sauces,Condiments,Woeber's,Woeber's Horseradish Sauce,,3.29,0,15388.jpg,,16,oz,,2
Cooking Needs,Condiments & Sauces,Condiments,Woeber's,Woeber's Whole Grain Dijon Mustard,,1.29,0,No Image.jpg,,4.25,oz,,2
Cooking Needs,Condiments & Sauces,Fresh Dips & Tapenades,Cabot,Cabot French Onion Dip,,3.09,0,17327.jpg,,12,oz,,
Cooking Needs,Condiments & Sauces,Fresh Dips & Tapenades,Cabot Creamery,"Cabot Creamery Dip, French Onion",,3.09,0,17329.jpg,,1.5,lb,,
Cooking Needs,Condiments & Sauces,Fresh Dips & Tapenades,Cedar,Cedar Garlic Hommus,,2.49,0,5505.jpg,,8,oz,,
Cooking Needs,Condiments & Sauces,Fresh Dips & Tapenades,Cedar,Cedar Garlic Hommus,,7.09,0,5512.jpg,,16,oz,,
Cooking Needs,Condiments & Sauces,Fresh Dips & Tapenades,Cedar,"Cedar Greek Style Yogurt Dip, Buffalo Bleu Cheese",,2.49,0,No Image.jpg,,11,oz,,
Cooking Needs,Condiments & Sauces,Fresh Dips & Tapenades,Cedar,Cedar Hommus Artichoke Kalamata,,2.49,0,5503.jpg,,8,oz,,
Cooking Needs,Condiments & Sauces,Fresh Dips & Tapenades,Cedar,Cedar Hommus Classic Original,,2.49,0,5499.jpg,,8,oz,,
Cooking Needs,Frozen Food,Frozen Appetizers & Sides,Alexia,Alexia All Natural House Cut Fries with Sea Salt,,3.69,0,2593.jpg,,1.75,lb,,18
Cooking Needs,Frozen Food,Frozen Appetizers & Sides,Alexia,Alexia All Natural Onion Rings,,3.69,0,2595.jpg,,12,oz,,18
Cooking Needs,Frozen Food,Frozen Appetizers & Sides,Alexia,Alexia Chipotle Seasoned Spicy Sweet Potato Fries,,3.69,0,2594.jpg,,20,oz,,18
Cooking Needs,Frozen Food,Frozen Appetizers & Sides,Alexia,"Alexia Fries, Seasoned, Waffle Cut",,3.69,0,2592.jpg,,20,oz,,18
Cooking Needs,Frozen Food,Frozen Appetizers & Sides,Alexia,Alexia Organic Yukon Select Fries With A Touch Of Sea Salt,,3.69,0,2591.jpg,,22,oz,,18
Cooking Needs,Frozen Food,Frozen Appetizers & Sides,Alexia,"Alexia Oven Reds with Olive Oil, Parmesan and Roasted Garlic",,3.69,0,2589.jpg,,22,oz,,18
Cooking Needs,Frozen Food,Frozen Appetizers & Sides,Alexia,Alexia Sweet Potato Fries with Sea Salt,,3.69,0,2588.jpg,,20,oz,,18
Cooking Needs,Frozen Food,Frozen Appetizers & Sides,Alexia,Alexia Waffle Cut Sweet Potato Seasoned Fries,,3.69,0,2590.jpg,,20,oz,,18
Cooking Needs,Frozen Food,Frozen Appetizers & Sides,Applegate,Applegate Natural Chicken Nuggets,,6.49,0,15809.jpg,,8,oz,,18
Cooking Needs,Frozen Food,Frozen Appetizers & Sides,Applegate,Applegate Natural Gluten Free Chicken Nuggets,,7.39,0,15819.jpg,,8,oz,,18
Cooking Needs,Frozen Food,Frozen Appetizers & Sides,Arby's,Arby's Seasoned Curly Fries,,2.49,0,15813.jpg,,22,oz,,18
Cooking Needs,Frozen Food,Frozen Appetizers & Sides,Bagel Bites,Bagel Bites Cheese & Pepperoni Pizza Snacks,,2.09,0,15823.jpg,,9,count,,18
Cooking Needs,Frozen Food,Frozen Appetizers & Sides,Bell & Evans,Bell & Evans Breaded Chicken Breast Tenders,,7.39,0,15853.jpg,,12,oz,,18
Cooking Needs,Frozen Food,Frozen Appetizers & Sides,Bell & Evans,Bell & Evans Coconut Breaded Chicken Breast Tenders,,7.39,0,15870.jpg,,12,oz,,18
Cooking Needs,Frozen Food,Frozen Appetizers & Sides,Bell & Evans,Bell & Evans Uncooked Chicken Breast Nuggets Breaded,,7.39,0,15869.jpg,,12,oz,,18
Cooking Needs,Frozen Food,Frozen Appetizers & Sides,Birds Eye,Birds Eye Selects Whole Grain Brown Rice,,1.89,0,2612.jpg,,10,oz,,18
Cooking Needs,Frozen Food,Frozen Appetizers & Sides,Birds Eye,Birds Eye Steamfresh Chefâ€™s Favorites Lightly Sauced & Vegetables with Tomato Parmesan Sauce,,2.49,0,15821.jpg,,10.8,oz,,18
Cooking Needs,Frozen Food,Frozen Appetizers & Sides,Birds Eye,Birds Eye Steamfresh Selects Long Grain White Rice,,1.29,0,2610.jpg,,10,oz,,18
Cooking Needs,Frozen Food,Frozen Appetizers & Sides,Birds Eye,Birds Eye Steamfresh Selects Sweet Peas,,2.99,0,2428.jpg,,10,oz,,18
Cooking Needs,Frozen Food,Frozen Appetizers & Sides,Birds Eye,Birds Eye Steamfresh Veggie Madeâ„¢ Original Riced Cauliflower,,3.09,0,2611.jpg,,10,oz,,18
Cooking Needs,Frozen Food,Frozen Appetizers & Sides,Chef Gusto,Chef Gusto Three Cheese Mini Pizza Bagels,,6.09,0,Market Basket.jpg,,1,ct,,18
Cooking Needs,Frozen Food,Frozen Appetizers & Sides,Chung's,Chung's Vegetable Eggroll,,5.79,0,Market Basket.jpg,,8,count,,18
Cooking Needs,Frozen Food,Frozen Appetizers & Sides,Chung's,"Chungs Egg Rolls, Chicken, White Meat",,5.79,0,15849.jpg,,8,count,,18
Cooking Needs,Frozen Food,Frozen Appetizers & Sides,Chung's,"Chungs Potstickers, Pork",,4.89,0,15811.jpg,,19.5,oz,,18
Cooking Needs,Frozen Food,Frozen Appetizers & Sides,Coleman,Coleman Breaded Chicken Breast Nuggets,,5.79,0,15844.jpg,,0.5,lb,,18
Cooking Needs,Frozen Food,Frozen Appetizers & Sides,Market Basket,Market Basket Shredded Hash Browns,,1.89,0,Market Basket.jpg,,30,oz,,18
Cooking Needs,Frozen Food,Frozen Appetizers & Sides,Market Basket,Market Basket Tater Tots,,2.39,0,Market Basket.jpg,,32,oz,,18
Cooking Needs,Frozen Food,Frozen Appetizers & Sides,Market Basket,Market Basket Waffle Cut Fries,,1.89,0,Market Basket.jpg,,24,oz,,18
Cooking Needs,Frozen Food,Frozen Appetizers & Sides,McCain,McCain 5 Minute Fries Shoestring Cut Potatoes,,2.49,0,2580.jpg,,20,oz,,18
Cooking Needs,Frozen Food,Frozen Appetizers & Sides,McCain,McCain Classic Fries Straight Cut Potatoes,,3.09,0,2587.jpg,,32,oz,,18
Cooking Needs,Frozen Food,Frozen Appetizers & Sides,McCain,McCain Crinkle Fries Crinkle Cut Potatoes,,2.49,0,2581.jpg,,32,oz,,18
Cooking Needs,Frozen Food,Frozen Appetizers & Sides,McCain,McCain Mini Potato Hash Browns,,3.09,0,2579.jpg,,20,oz,,18
Cooking Needs,Frozen Food,Frozen Appetizers & Sides,McCain,McCain Savory Herbs & Spices Potato Wedges,,3.09,0,2584.jpg,,26,oz,,18
Cooking Needs,Frozen Food,Frozen Appetizers & Sides,McCain,McCain Seasoned Crinkle Potato Fries,,2.49,0,2582.jpg,,26,oz,,18
Cooking Needs,Frozen Food,Frozen Appetizers & Sides,McCain,McCain Seasoned Curly Fries,,3.09,0,2585.jpg,,26,oz,,18
Cooking Needs,Frozen Food,Frozen Appetizers & Sides,McCain,McCain Seasoned Shredded Potatoes,,2.49,0,2586.jpg,,32,oz,,18
Cooking Needs,Frozen Food,Frozen Appetizers & Sides,McCain,McCain Smiles Potatoes,,2.49,0,2578.jpg,,26,oz,,18
Cooking Needs,Frozen Food,Frozen Appetizers & Sides,McCain,McCain Steak Fries Steak Cut Potatoes,,2.49,0,2583.jpg,,28,oz,,18
Cooking Needs,Frozen Food,Frozen Appetizers & Sides,Michelina's,Michelina's Pizza Snack Rolls,,1.29,0,15856.jpg,,4.5,oz,,18
Cooking Needs,Frozen Food,Frozen Appetizers & Sides,Monterey,El Monterey Beef & Cheese Taquitos,,6.69,0,15825.jpg,,21,oz,,18
Cooking Needs,Frozen Food,Frozen Appetizers & Sides,Monterey,Pepperidge Farm Texas Toast Frozen Mozzarella & Monterey Jack Bread,,2.49,0,15837.jpg,,9.5,oz,,18
Cooking Needs,Frozen Food,Frozen Appetizers & Sides,Mrs. Paul's,Mrs. Paul's Crunchy Fish Sticks,,5.79,0,15874.jpg,,44,count,,18
Cooking Needs,Frozen Food,Frozen Appetizers & Sides,Mrs. T's,Mrs. T's Loaded Baked Potato Pierogies,,2.49,0,15835.jpg,,12,x 16 oz,,18
Cooking Needs,Frozen Food,Frozen Appetizers & Sides,Nathan's,Nathan's Battered Onion Rings Thick Sliced,,2.49,0,15839.jpg,,16,oz,,18
Cooking Needs,Frozen Food,Frozen Appetizers & Sides,Ore-Ida,Ore Ida French Fried Potatoes,,3.59,0,2575.jpg,,32,oz,,18
Cooking Needs,Frozen Food,Frozen Appetizers & Sides,Ore-Ida,Ore Ida Golden Crispers French Fried Potatoes,,3.59,0,2576.jpg,,20,oz,,18
Cooking Needs,Frozen Food,Frozen Appetizers & Sides,Ore-Ida,Ore Ida Golden French Fried Potatoes,,3.59,0,2565.jpg,,32,oz,,18
Cooking Needs,Frozen Food,Frozen Appetizers & Sides,Ore-Ida,Ore Ida Golden Steak Fries French Fried Potatoes,,3.59,0,2572.jpg,,28,oz,,18
Cooking Needs,Frozen Food,Frozen Appetizers & Sides,Ore-Ida,Ore Ida Golden Tater Tots,,4.09,0,2569.jpg,,32,oz,,18
Cooking Needs,Frozen Food,Frozen Appetizers & Sides,Ore-Ida,Ore Ida Onion Ringers,,3.59,0,2574.jpg,,20,oz,,18
Cooking Needs,"Rice, Grain, Pasta & Beans",Dry Pasta,Ancient Harvest,Ancient Harvest Gluten Free Organic Supergrain Pasta Spaghetti,,3.69,0,17342.jpg,,8,oz,,4
Cooking Needs,"Rice, Grain, Pasta & Beans",Dry Pasta,Ancient Harvest,Ancient Harvest Organic Gluten Free Pasta Linguine,,3.69,0,17348.jpg,,8,oz,,4
Cooking Needs,"Rice, Grain, Pasta & Beans",Dry Pasta,Ancient Harvest,Ancient Harvest Organic Pasta,,3.69,0,17347.jpg,,8,oz,,4
Cooking Needs,"Rice, Grain, Pasta & Beans",Dry Pasta,Ancient Harvest,Ancient Harvest Organic Supergrain Pasta Penne Corn & Quinoa,,3.69,0,5620.jpg,,9.6,oz,,4
Cooking Needs,"Rice, Grain, Pasta & Beans",Dry Pasta,Ancient Harvest,Ancient Harvest POW! Power Protein Pasta Red Lentil Rotini,,3.09,0,5618.jpg,,8,fl oz,,4
Cooking Needs,"Rice, Grain, Pasta & Beans",Dry Pasta,Barilla,Barilla Classic Blue Box Oven Pasta Wavy Lasagne,,2.19,0,5581.jpg,,16,oz,,4
Cooking Needs,"Rice, Grain, Pasta & Beans",Dry Pasta,Barilla,Barilla Classic Blue Box Oven Ready Pasta Lasagne,,1.89,0,5580.jpg,,9,oz,,4
Cooking Needs,"Rice, Grain, Pasta & Beans",Dry Pasta,Barilla,Barilla Classic Blue Box Pasta Elbows,,1.59,0,5564.jpg,,1,lb,,4
Cooking Needs,"Rice, Grain, Pasta & Beans",Dry Pasta,Barilla,Barilla Classic Blue Box Pasta Fettuccine,,1.59,0,5574.jpg,,16,oz,,4
Cooking Needs,"Rice, Grain, Pasta & Beans",Dry Pasta,Barilla,Barilla Classic Blue Box Pasta Rotini,,1.59,0,5561.jpg,,1,lb,,4
Cooking Needs,"Rice, Grain, Pasta & Beans",Dry Pasta,Barilla,Barilla Classic Blue Box Pasta Thin Spaghetti,,1.59,0,5567.jpg,,16,oz,,4
Cooking Needs,"Rice, Grain, Pasta & Beans",Dry Pasta,Barilla,Barilla Collezione Artisanal Selection Pasta Tortellini Cheese & Spinach,,4.89,0,5587.jpg,,12,oz,,4
Cooking Needs,"Rice, Grain, Pasta & Beans",Dry Pasta,Barilla,Barilla Fully Coocked Ready Pasta Rotini,,2.09,0,5584.jpg,,8.5,oz,,4
Cooking Needs,"Rice, Grain, Pasta & Beans",Dry Pasta,Barilla,Barilla Gluten Free Pasta Penne,,2.49,0,5572.jpg,,12,oz,,4
Cooking Needs,"Rice, Grain, Pasta & Beans",Dry Pasta,Barilla,Barilla Gluten Free Pasta Spaghetti,,2.49,0,5582.jpg,,12,oz,,4
Cooking Needs,"Rice, Grain, Pasta & Beans",Dry Pasta,Barilla,Barilla Protein+ Grain & Legume Pasta Elbows,,2.49,0,5578.jpg,,14.5,oz,,4
Cooking Needs,"Rice, Grain, Pasta & Beans",Dry Pasta,Barilla,Barilla Protein+ Grain & Legume Pasta Penne,,2.49,0,5568.jpg,,14.5,oz,,4
Cooking Needs,"Rice, Grain, Pasta & Beans",Dry Pasta,Barilla,Barilla Protein+ Grain & Legume Pasta Spaghetti,,2.49,0,5575.jpg,,14.5,oz,,4
Cooking Needs,"Rice, Grain, Pasta & Beans",Dry Pasta,Barilla,Barilla Whole Grain Pasta Spaghetti,,1.59,0,5576.jpg,,16,oz,,4
Cooking Needs,"Rice, Grain, Pasta & Beans",Dry Pasta,Barilla,Barilla Whole Grain Pasta Wavy Lasagne,,2.19,0,17337.jpg,,13.25,oz,,4
Cooking Needs,"Rice, Grain, Pasta & Beans",Dry Pasta,De Cecco,De Cecco Pasta Rigatoni,,2.49,0,5616.jpg,,16,oz,,4
Cooking Needs,"Rice, Grain, Pasta & Beans",Dry Pasta,Dreamfields,Dreamfields Elbows,,2.49,0,17345.jpg,,13.25,oz,,4
Cooking Needs,"Rice, Grain, Pasta & Beans",Dry Pasta,Dreamfields,Dreamfields Healthy Carb Living Elbows Pasta,,2.49,0,17339.jpg,,13.25,oz,,4
Cooking Needs,"Rice, Grain, Pasta & Beans",Dry Pasta,Dreamfields,Dreamfields Healthy Carb Living Penne Rigate,,2.49,0,No Image.jpg,,13.25,oz,,4
Cooking Needs,"Rice, Grain, Pasta & Beans",Dry Pasta,Light 'n Fluffy,Light 'N Fluffy Extra Wide Egg Noodles,,1.89,0,17332.jpg,,12,oz,,4
Cooking Needs,"Rice, Grain, Pasta & Beans",Dry Pasta,No Yolks,No Yolks Cholesterol Free Egg White Pasta Extra Broad Noodles,,2.49,0,17341.jpg,,12,oz,,4
Cooking Needs,"Rice, Grain, Pasta & Beans",Dry Pasta,Pennsylvania Dutch,Pennsylvania Dutch Pennsylvania Extra Wide Egg Noodles,,2.49,0,5626.jpg,,12,oz,,4
Cooking Needs,"Rice, Grain, Pasta & Beans",Dry Pasta,Goya,"Goya Angel Hair, Enriched",,1.49,0,5610.jpg,,16,oz,,4
Cooking Needs,"Rice, Grain, Pasta & Beans",Dry Pasta,Goya,"Goya Enriched Macaroni Product, Shells",,0.69,0,5609.jpg,,7,oz,,4
Cooking Needs,"Rice, Grain, Pasta & Beans",Dry Pasta,Goya,Goya Pasta Shells,,1.29,0,5607.jpg,,16,oz,,4
Cooking Needs,"Rice, Grain, Pasta & Beans",Dry Pasta,Goya,"Goya Spaghetti, Enriched",,1.29,0,5611.jpg,,16,oz,,4
Cooking Needs,"Rice, Grain, Pasta & Beans",Dry Pasta,Joy,Tinkyada Pasta Joy Ready Brown Rice Pasta Lasagne,,4.29,0,17349.jpg,,10,oz,,4
Cooking Needs,"Rice, Grain, Pasta & Beans",Dry Pasta,Light 'n Fluffy,Light 'N Fluffy Medium Egg Noodles,,3.29,0,17346.jpg,,12,oz,,4
Cooking Needs,"Rice, Grain, Pasta & Beans",Dry Pasta,Light 'n Fluffy,Light 'N Fluffy Wide Egg Noodles,,1.89,0,17335.jpg,,12,oz,,4
Cooking Needs,"Rice, Grain, Pasta & Beans",Dry Pasta,Lucio Garofalo,Lucio Garofalo Elbow Pasta,,1.09,0,No Image.jpg,,16,oz,,4
Cooking Needs,"Rice, Grain, Pasta & Beans",Dry Pasta,Lucio Garofalo,Lucio Garofalo Pasta Spaghetti,,1.09,0,No Image.jpg,,16,oz,,4
Cooking Needs,"Rice, Grain, Pasta & Beans",Dry Pasta,Lucio Garofalo,Lucio Garofalo Penne Rigate Pasta,,1.09,0,No Image.jpg,,16,oz,,4
Cooking Needs,"Rice, Grain, Pasta & Beans",Dry Pasta,Lucio Garofalo,Lucio Garofalo Shells Pasta,,1.09,0,No Image.jpg,,16,oz,,4
Cooking Needs,"Rice, Grain, Pasta & Beans",Dry Pasta,Market Basket,Market Basket Angel Hair Pasta,,12.19,0,Market Basket.jpg,,1,ct,,4
Cooking Needs,"Rice, Grain, Pasta & Beans",Dry Pasta,Market Basket,Market Basket Cavatappi Pasta,,1.29,0,Market Basket.jpg,,16,oz,,4
Cooking Needs,"Rice, Grain, Pasta & Beans",Dry Pasta,Market Basket,Market Basket Ditalini Pasta,,3.09,0,Market Basket.jpg,,16,oz,,4
Cooking Needs,"Rice, Grain, Pasta & Beans",Dry Pasta,Market Basket,Market Basket Elbow Macaroni,,1.69,0,Market Basket.jpg,,16,oz,,4
Cooking Needs,"Rice, Grain, Pasta & Beans",Dry Pasta,Market Basket,Market Basket Fettuccine,,1.29,0,Market Basket.jpg,,16,oz,,4
Cooking Needs,"Rice, Grain, Pasta & Beans",Dry Pasta,Market Basket,Market Basket Linguine,,3.09,0,Market Basket.jpg,,16,oz,,4
Cooking Needs,"Rice, Grain, Pasta & Beans",Dry Pasta,Market Basket,Market Basket Long Spaghetti,,1.29,0,Market Basket.jpg,,1,ct,,4
Cooking Needs,"Rice, Grain, Pasta & Beans",Dry Pasta,Market Basket,Market Basket Medium Shells Pasta,,1.29,0,Market Basket.jpg,,16,oz,,4
