Category,Sub Catagory,Type,Brand,product,Product Description,Price,Tax,Image,Store,Size,UOM,Spice Level,Aisle No.
"Beverages, Chips & Snacks",Chips & Snacks,Crackers,Cheez-It,Cheez It Baked Snack Cheese Crackers Reduced Fat Original,,6.23,0,14900.jpg,,19,oz,,6
"Beverages, Chips & Snacks",Chips & Snacks,Chips & Pretzels,Chex Mix,Chex Mix Traditional Savory Snack Mix,,4.67,0,14853.jpg,,15,oz,,0
"Beverages, Chips & Snacks",Chips & Snacks,Chips & Pretzels,Chex Mix,Chex Mix Cheddar Savory Snack Mix,,4.67,0,bcs0006.jpg,,15,oz,,0
"Beverages, Chips & Snacks",Chips & Snacks,Chips & Pretzels,Chex Mix,Chex Mix Honey Nut Snack Mix,,3.13,0,bcs0007.jpg,,8.5,oz,,0
"Beverages, Chips & Snacks",Chips & Snacks,Chips & Pretzels,Chex Mix,Chex Mix Bold Snack Mix,,3.13,0,bcs0008.jpg,,8.5,oz,,0
"Beverages, Chips & Snacks",Chips & Snacks,Chips & Pretzels,Doritos,Doritos Cool Ranch Tortilla Chips,,5.47,0,953.jpg,,9.75,oz,,0
"Beverages, Chips & Snacks",Chips & Snacks,Chips & Pretzels,Doritos,Doritos Nacho Cheese Flavored Tortilla Chips,,5.47,0,955.jpg,,9.75,oz,,0
"Beverages, Chips & Snacks",Chips & Snacks,Chips & Pretzels,Doritos,Doritos Spicy Nacho Flavored Tortilla Chips,,5.47,0,956.jpg,,9.75,oz,,0
"Beverages, Chips & Snacks",Chips & Snacks,Chips & Pretzels,Doritos,Doritos Spicy Sweet Chilli Tortilla Chips,,5.47,0,bcs0009.jpg,,9.75,,,0
"Beverages, Chips & Snacks",Chips & Snacks,Chips & Pretzels,Eatsmart Snacks,Eatsmart Snacks Garden Veggie Crisps with Sea Salt,,3.91,0,14879.jpg,,6,oz,,0
"Beverages, Chips & Snacks",Chips & Snacks,Chips & Pretzels,Eatsmart Snacks,Eatsmart Snacks Garden Veggie Sticks with Potato Tomato & Spinach,,3.91,0,14849.jpg,,7,oz,,0
"Beverages, Chips & Snacks",Chips & Snacks,Chips & Pretzels,Food Should Taste Good,"Food Should Taste Good Multigrain  Tortilla Chips, Gluten Free",,4.69,0,17948.jpg,,5.5,oz,,0
"Beverages, Chips & Snacks",Chips & Snacks,Chips & Pretzels,Food Should Taste Good,"Food Should Taste Good Sweet Potato Tortilla Chips, Gluten Free",,4.69,0,bcs0010.jpg,,5.5,oz,,0
"Beverages, Chips & Snacks",Chips & Snacks,Chips & Pretzels,Food Should Taste Good,"Food Should Taste Good Blue Corn  Tortilla Chips, Gluten Free",,4.69,0,bcs0011.jpg,,5.5,oz,,0
"Beverages, Chips & Snacks",Chips & Snacks,Chips & Pretzels,Garden of Eatin',Garden of Eatin' Corn Tortilla Chips Blue Chips,,5.47,0,14892.jpg,,8.1,oz,,0
"Beverages, Chips & Snacks",Chips & Snacks,Chips & Pretzels,Good Health,Good Health Veggie Stix Sea Salt,,4.69,0,14860.jpg,,6.25,oz,,0
"Beverages, Chips & Snacks",Chips & Snacks,Chips & Pretzels,Good Health,Good Health Veggie Straws Sea Salt,,4.69,0,14813.jpg,,6.25,oz,,0
"Beverages, Chips & Snacks",Chips & Snacks,Chips & Pretzels,Kettle,"Kettle Brand Potato Chips, Backyard Barbeque Kettle Chips",,4.69,0,14896.jpg,,8.5,oz,,0
"Beverages, Chips & Snacks",Chips & Snacks,Chips & Pretzels,Kettle,"Kettle Brand Potato Chips, Krinkle Cut Salt & Ground Pepper Kettle Chips",,4.69,0,14880.jpg,,8.5,oz,,0
"Beverages, Chips & Snacks",Chips & Snacks,Chips & Pretzels,Kettle,"Kettle Brand Potato Chips, Sea Salt & Vinegar Kettle Chips",,4.69,0,14858.jpg,,8.5,oz,,0
"Beverages, Chips & Snacks",Chips & Snacks,Chips & Pretzels,Kettle,Kettle Brand Jalapeno Jack Potato Chips,,4.69,0,14874.jpg,,8.5,oz,,0
"Beverages, Chips & Snacks",Chips & Snacks,Chips & Pretzels,LATE JULY,LATE JULY Snacks Restaurant Style Sea Salt Thin & Crispy Organic Tortilla Chips,,4.69,0,14859.jpg,,11,oz,,0
"Beverages, Chips & Snacks",Chips & Snacks,Chips & Pretzels,Frito Lay's,Frito Lay's & Mix Variety Pack,,6.23,0,14827.jpg,,10 x 1,oz,,0
"Beverages, Chips & Snacks",Beverages & Water,Cocoa & Drink Mixes,4C,4C Fruit Punch,,1.88,0,bcs0330.jpg,,18.6,oz,,17
"Beverages, Chips & Snacks",Beverages & Water,Cocoa & Drink Mixes,4C,4C Half & Half Iced Tea Lemonade,,6.24,0,bcs0331.jpg,,47.2,oz,,17
"Beverages, Chips & Snacks",Beverages & Water,Cocoa & Drink Mixes,4C,4C Half & Half Iced Tea Lemonade,,4.99,0,bcs0332.jpg,,13.9,oz,,17
"Beverages, Chips & Snacks",Beverages & Water,Cocoa & Drink Mixes,4C,4C Light Green Tea with Honey,,4.99,0,bcs0333.jpg,,13.9,oz,,17
"Beverages, Chips & Snacks",Beverages & Water,Cocoa & Drink Mixes,4C,4C Fruit Punch,,6.24,0,bcs0334.jpg,,58,oz,,17
"Beverages, Chips & Snacks",Beverages & Water,Cocoa & Drink Mixes,4C,4C Lemonade,,6.24,0,bcs0335.jpg,,58,oz,,17
"Beverages, Chips & Snacks",Beverages & Water,Cocoa & Drink Mixes,4C,4C Lemonade,,1.88,0,bcs0336.jpg,,18.6,oz,,17
"Beverages, Chips & Snacks",Beverages & Water,Cocoa & Drink Mixes,4C,4C Ice Tea Mix Decaffeinated,,6.24,0,bcs0337.jpg,,47.2,oz,,17
"Beverages, Chips & Snacks",Beverages & Water,Cocoa & Drink Mixes,4C,4C Ice Tea Mix Decaffeinated,,1.88,0,bcs0338.jpg,,13.9,oz,,17
"Beverages, Chips & Snacks",Beverages & Water,Cocoa & Drink Mixes,4C,4C Iced Tea Mix Peach,,6.24,0,bcs0339.jpg,,4,lb,,17
"Beverages, Chips & Snacks",Beverages & Water,Cocoa & Drink Mixes,4C,4C Iced Tea Mix Natural Lemon Flavor,,6.24,0,bcs0340.jpg,,4,lb,,17
"Beverages, Chips & Snacks",Beverages & Water,Cocoa & Drink Mixes,Tang,Tang Orange Naranja Drink Mix,,3.36,0,bcs0341.jpg,,20,oz,,17
"Beverages, Chips & Snacks",Beverages & Water,Cocoa & Drink Mixes,Tang,Tang Orange Mango Drink Mix,,3.36,0,bcs0342.jpg,,19.7,oz,,17
"Beverages, Chips & Snacks",Beverages & Water,Single To-Go Coffee,Dunkin' Donuts,Dunkin' Donuts Cold Brew Coffee Midnight Black,,1.88,0,bcs0343.jpg,,9,fl oz,,17
"Beverages, Chips & Snacks",Beverages & Water,Single To-Go Coffee,Dunkin' Donuts,Dunkin' Donuts Original Iced Coffee,,3.13,0,bcs0344.jpg,,13.7,fl oz,,17
"Beverages, Chips & Snacks",Beverages & Water,Single To-Go Coffee,Dunkin' Donuts,Dunkin' Donuts Iced Mocha,,3.13,0,bcs0345.jpg,,13.7,fl oz,,17
"Beverages, Chips & Snacks",Beverages & Water,Single To-Go Coffee,Dunkin' Donuts,Dunkin' Donuts French Vanilla,,3.13,0,bcs0346.jpg,,13.7,fl oz,,17
"Beverages, Chips & Snacks",Beverages & Water,Single To-Go Coffee,Dunkin' Donuts,Dunkin' Donuts Iced Coffee Espresso,,3.13,0,bcs0347.jpg,,13.7,fl oz,,17
"Beverages, Chips & Snacks",Beverages & Water,Single To-Go Coffee,Starbucks,Starbucks Cold Brew Cocoa & Honey Flavored,,3.74,0,bcs0348.jpg,,11,fl oz,,17
"Beverages, Chips & Snacks",Beverages & Water,Single To-Go Coffee,Starbucks,Starbucks Doubleshot Espresso Cans 4 Pack,,3.11,0,bcs0349.jpg,,4 x 6.5,fl oz,,17
"Beverages, Chips & Snacks",Beverages & Water,Single To-Go Coffee,Starbucks,Starbucks Doubleshot Americano Cans 4 Pack,,3.11,0,bcs0350.jpg,,4 x 6.5,fl oz,,17
"Beverages, Chips & Snacks",Beverages & Water,Single To-Go Coffee,Starbucks,Starbucks Tripleshot Energy French Vanilla,,3.36,0,bcs0351.jpg,,15,fl oz,,17
"Beverages, Chips & Snacks",Beverages & Water,Single To-Go Coffee,Starbucks,Starbucks Tripleshot Energy Dark Roast,,3.36,0,bcs0352.jpg,,15,fl oz,,17
"Beverages, Chips & Snacks",Beverages & Water,Single To-Go Coffee,Starbucks,Starbucks Tripleshot Energy Cafe Mocha,,3.36,0,bcs0353.jpg,,15,fl oz,,17
"Beverages, Chips & Snacks",Beverages & Water,Single To-Go Coffee,Starbucks,Starbucks Tripleshot Energy Caramel,,3.36,0,bcs0354.jpg,,15,fl oz,,17
"Beverages, Chips & Snacks",Beverages & Water,Single To-Go Coffee,Starbucks,Starbucks Doubleshot Energy Vanilla,,3.36,0,bcs0355.jpg,,15,fl oz,,17
"Beverages, Chips & Snacks",Beverages & Water,Single To-Go Coffee,Starbucks,Starbucks Doubleshot Energy Mocha,,3.36,0,bcs0356.jpg,,15,fl oz,,17
"Beverages, Chips & Snacks",Beverages & Water,Single To-Go Coffee,Starbucks,Starbucks Doubleshot Energy Coffee,,3.36,0,bcs0357.jpg,,15,fl oz,,17
"Beverages, Chips & Snacks",Beverages & Water,Single To-Go Coffee,Starbucks,Stabucks Frappuccino Vanilla,,3.36,0,bcs0358.jpg,,13.7,fl oz,,17
"Beverages, Chips & Snacks",Beverages & Water,Single To-Go Coffee,Starbucks,Starbucks Frappuccino Salted Dark Chocolate,,3.36,0,bcs0359.jpg,,13.7,fl oz,,17
"Beverages, Chips & Snacks",Beverages & Water,Cocoa & Drink Mixes,Powell & Mahoney,Powell & Mahoney Classic Margarita,,8.74,0,bcs0396.jpg,,750,ml,,17
"Beverages, Chips & Snacks",Beverages & Water,Cocoa & Drink Mixes,Powell & Mahoney,Powell & Mahoney Classic Bloody Mary,,8.74,0,bcs0397.jpg,,750,ml,,17
"Beverages, Chips & Snacks",Beverages & Water,Cocoa & Drink Mixes,Cocktail Artist,Cocktail Artist Strawberry Daiquiri-Margarita Mix,,6.24,0,bcs0398.jpg,,1,L,,17
"Beverages, Chips & Snacks",Beverages & Water,Cocoa & Drink Mixes,Cocktail Artist,Cocktail Artist Pina Colada Premium Mix,,6.24,0,bcs0399.jpg,,1,L,,17
"Beverages, Chips & Snacks",Beverages & Water,Cocoa & Drink Mixes,Cocktail Artist,Cocktail Artist Margarita Premium Mix,,6.24,0,bcs0400.jpg,,1,L,,17
"Beverages, Chips & Snacks",Beverages & Water,Cocoa & Drink Mixes,Cocktail Artist,Cocktail Artist Bloody Mary Premium Mix,,6.24,0,bcs0401.jpg,,1,L,,17
"Beverages, Chips & Snacks",Beverages & Water,Cocoa & Drink Mixes,Finest Call,Finest Call Premium Strawberry Puree Mix,,4.99,0,bcs0402.jpg,,33.8,fl oz,,17
"Beverages, Chips & Snacks",Beverages & Water,Cocoa & Drink Mixes,Finest Call,Finest Call Premium Margarita Mix,,4.99,0,bcs0403.jpg,,33.8,fl oz,,17
"Beverages, Chips & Snacks",Beverages & Water,Cocoa & Drink Mixes,Finest Call,Finest Call Premium Mango Mix,,4.99,0,bcs0404.jpg,,33.8,fl oz,,17
"Beverages, Chips & Snacks",Beverages & Water,Cocoa & Drink Mixes,Finest Call,Finest Call Premium Sweet & Sour Mix,,4.99,0,bcs0405.jpg,,33.8,fl oz,,17
"Beverages, Chips & Snacks",Beverages & Water,Cocoa & Drink Mixes,Mr & Mrs T,Mr & Mrs T Sweet & Sour Mix,,4.99,0,bcs0406.jpg,,1,L,,17
"Beverages, Chips & Snacks",Beverages & Water,Cocoa & Drink Mixes,Mr & Mrs T,Mr & Mrs T Strawberry Daiquiri-Margarita Mix,,4.99,0,bcs0407.jpg,,1,L,,17
"Beverages, Chips & Snacks",Beverages & Water,Cocoa & Drink Mixes,Mr & Mrs T,Mr & Mrs T Pina Colada Mix,,4.99,0,bcs0408.jpg,,1,L,,17
"Beverages, Chips & Snacks",Beverages & Water,Cocoa & Drink Mixes,Mr & Mrs T,Mr & Mrs T Whiskey Sour Mix,,4.99,0,bcs0409.jpg,,1,L,,17
"Beverages, Chips & Snacks",Beverages & Water,Cocoa & Drink Mixes,Mr & Mrs T,Mr & Mrs T Original Margarita Mix,,4.99,0,bcs0410.jpg,,1,L,,17
"Beverages, Chips & Snacks",Beverages & Water,Cocoa & Drink Mixes,Mr & Mrs T,Mr & Mrs T Bold & Spicy Bloody Mary Mix,,4.99,0,bcs0411.jpg,,1,L,,17
"Beverages, Chips & Snacks",Breakfast Bars & Pastries,Breakfast Bars,Atkins,Atkins Protein Rich Meal Bar Chocolate Chip Cookie Dough,,7.39,0,17653.jpg,,5,x 2.12 oz,,5
"Beverages, Chips & Snacks",Breakfast Bars & Pastries,Breakfast Bars,Atkins,Atkins Protein Rich Meal Bar Peanut Butter Granola,,9.19,0,17654.jpg,,8.5,oz,,5
"Beverages, Chips & Snacks",Breakfast Bars & Pastries,Breakfast Bars,Atkins,Atkins Snack Bar Cranberry Almond,,7.39,0,17672.jpg,,5,x 1.23 oz,,5
"Beverages, Chips & Snacks",Breakfast Bars & Pastries,Breakfast Bars,Enjoy Life,Enjoy Life Soft Baked Chewy Bars Cocoa Loco,,4.29,0,17655.jpg,,5,x 1.1oz,,5
"Beverages, Chips & Snacks",Breakfast Bars & Pastries,Twists,Entenmann's,Entenmann's Cheese Danish Twist,,8.69,0,6224.jpg,,15,oz,,
"Beverages, Chips & Snacks",Breakfast Bars & Pastries,Donuts,Entenmann's,Entenmann's Cinnamon Bagged Donuts,,3.69,0,6221.jpg,,10,oz,,
"Beverages, Chips & Snacks",Breakfast Bars & Pastries,Twists,Entenmann's,Entenmann's Cinnamon Swirl Buns,,3.69,0,6218.jpg,,18,oz,,
"Beverages, Chips & Snacks",Breakfast Bars & Pastries,Muffins,Entenmann's,Entenmann's Little Bites Blueberry Mini Muffins made with Real Blueberries,,3.69,0,6219.jpg,,20,x 0.41 oz,,
"Beverages, Chips & Snacks",Breakfast Bars & Pastries,Donuts,Entenmann's,Entenmann's Powdered Bagged Donuts,,3.69,0,6225.jpg,,10,oz,,
"Beverages, Chips & Snacks",Breakfast Bars & Pastries,Donuts,Entenmann's,Entenmann's Powdered Donuts Pop'ettes,,3.69,0,6220.jpg,,14,oz,,
"Beverages, Chips & Snacks",Breakfast Bars & Pastries,Twists,Entenmann's,Entenmann's Raspberry Danish Twist,,8.69,0,6223.jpg,,15,oz,,
"Beverages, Chips & Snacks",Breakfast Bars & Pastries,Donuts,Entenmann's,Entenmann's Soft'ees Assorted With Frosted Donuts,,3.69,0,6222.jpg,,21,oz,,
"Beverages, Chips & Snacks",Breakfast Bars & Pastries,Brownies,Fiber One,Fiber One Brownies,,3.69,0,6228.jpg,,6,x 0.89 oz,,
"Beverages, Chips & Snacks",Breakfast Bars & Pastries,Breakfast Bars,Fiber One,"Fiber One Chewy Bars, Oats & Chocolate",,3.69,0,6229.jpg,,5,x 1.4 oz,,5
"Beverages, Chips & Snacks",Breakfast Bars & Pastries,Breakfast Bars,Fiber One,Fiber One Chocolate Chewy Bars,,3.69,0,6230.jpg,,5,x 0.82 oz,,5
"Beverages, Chips & Snacks",Breakfast Bars & Pastries,Breakfast Bars,Fiber One,"Fiber One Protein Bar, Caramel Nut Chewy Bars",,3.09,0,6226.jpg,,5,x 1.17 oz,,5
"Beverages, Chips & Snacks",Breakfast Bars & Pastries,Breakfast Bars,Fiber One,"Fiber One Protein Bar, Peanut Butter Chewy Bars",,3.69,0,6227.jpg,,5,x 1.17 oz,,5
"Beverages, Chips & Snacks",Breakfast Bars & Pastries,Breakfast Bars,Glutino,Glutino Apple Cinnamon Gluten Free Oven Baked Bars,,6.09,0,18108.jpg,,5,x 1.41 oz,,5
"Beverages, Chips & Snacks",Breakfast Bars & Pastries,Breakfast Bars,Kashi,Kashi Bars Mixed Berry,,3.69,0,6247.jpg,,1.1,oz,,5
"Beverages, Chips & Snacks",Breakfast Bars & Pastries,Breakfast Bars,Kashi,Kashi Granola Bars Chocolate Chip Chia,,3.09,0,6248.jpg,,5,x 7 oz,,5
"Beverages, Chips & Snacks",Breakfast Bars & Pastries,Biscuits,Kellogg's,Kellogg's Nutri Grain Apple Cinnamon Breakfast Biscuits,,4.89,0,6195.jpg,,5,x 1.4 oz,,
"Beverages, Chips & Snacks",Breakfast Bars & Pastries,Pastries,Kellogg's,Kellogg's Pop Tarts Breakfast Toaster Pastries Frosted Blueberry,,2.49,0,6213.jpg,,8,x 14.7 oz,,5
"Beverages, Chips & Snacks",Breakfast Bars & Pastries,Pastries,Kellogg's,Kellogg's Pop Tarts Breakfast Toaster Pastries Frosted Blueberry,,4.29,0,6215.jpg,,16,x 29.3 oz,,5
"Beverages, Chips & Snacks",Breakfast Bars & Pastries,Pastries,Kellogg's,Kellogg's Pop Tarts Breakfast Toaster Pastries Frosted Brown Sugar Cinnamon,,4.29,0,6203.jpg,,16,x 28.2 oz,,5
"Beverages, Chips & Snacks",Breakfast Bars & Pastries,Pastries,Kellogg's,Kellogg's Pop Tarts Breakfast Toaster Pastries Frosted Brown Sugar Cinnamon,,2.49,0,6212.jpg,,8,ct,,5
"Beverages, Chips & Snacks",Breakfast Bars & Pastries,Pastries,Kellogg's,Kellogg's Pop Tarts Breakfast Toaster Pastries Frosted Chocolate Chip,,4.29,0,6210.jpg,,16,x 29.3 oz,,5
"Beverages, Chips & Snacks",Breakfast Bars & Pastries,Pastries,Kellogg's,Kellogg's Pop Tarts Breakfast Toaster Pastries Frosted Chocolate Chip Cookie Dough,,4.29,0,6216.jpg,,16,x 28.2 oz,,5
"Beverages, Chips & Snacks",Breakfast Bars & Pastries,Pastries,Kellogg's,Kellogg's Pop Tarts Breakfast Toaster Pastries Frosted Chocolate Fudge,,4.29,0,6211.jpg,,16,x 29.3 oz,,5
"Beverages, Chips & Snacks",Breakfast Bars & Pastries,Pastries,Kellogg's,Kellogg's Pop Tarts Breakfast Toaster Pastries Frosted Cinnamon Roll,,2.49,0,6209.jpg,,14.1,oz,,5
"Beverages, Chips & Snacks",Breakfast Bars & Pastries,Pastries,Kellogg's,Kellogg's Pop Tarts Breakfast Toaster Pastries Frosted Hot Fudge Sundae,,4.29,0,6206.jpg,,16,x 27.1 oz,,5
"Beverages, Chips & Snacks",Breakfast Bars & Pastries,Pastries,Kellogg's,Kellogg's Pop Tarts Breakfast Toaster Pastries Frosted Raspberry,,2.49,0,6207.jpg,,8,ct,,5
"Beverages, Chips & Snacks",Breakfast Bars & Pastries,Pastries,Kellogg's,Kellogg's Pop Tarts Breakfast Toaster Pastries Frosted S'mores,,2.49,0,6205.jpg,,8,ct,,5
"Beverages, Chips & Snacks",Breakfast Bars & Pastries,Pastries,Kellogg's,Kellogg's Pop Tarts Breakfast Toaster Pastries Frosted Strawberry,,4.29,0,6202.jpg,,16,x 29.3 oz,,5
"Beverages, Chips & Snacks",Breakfast Bars & Pastries,Pastries,Kellogg's,Kellogg's Pop Tarts Breakfast Toaster Pastries Frosted Strawberry,,2.49,0,6208.jpg,,1,fl oz,,5
"Beverages, Chips & Snacks",Breakfast Bars & Pastries,Pastries,Kellogg's,Kellogg's Pop Tarts Breakfast Toaster Pastries Frosted Wild! Berry,,2.49,0,6204.jpg,,8,x 15.2 oz,,5
"Beverages, Chips & Snacks",Breakfast Bars & Pastries,Pastries,Kellogg's,Kellogg's Pop Tarts Breakfast Toaster Pastries Unfrosted Blueberry,,2.49,0,6217.jpg,,8,x 14.7 oz,,5
"Beverages, Chips & Snacks",Breakfast Bars & Pastries,Pastries,Kellogg's,Kellogg's Pop Tarts Breakfast Toaster Pastries Unfrosted Strawberry,,2.49,0,6214.jpg,,8,x 14.7 oz,,5
"Beverages, Chips & Snacks",Breakfast Bars & Pastries,Pastries,Kellogg's,Kellogg's Pop Tarts Frosted Brown Sugar Cinnamon Toaster Pastries,,2.49,0,6194.jpg,,21,oz,,5
"Beverages, Chips & Snacks",Breakfast Bars & Pastries,Pastries,Kellogg's,Kellogg's Pop Tarts Frosted Confetti Cupcake Toaster Pastries,,2.49,0,6193.jpg,,14.1,oz,,5
"Beverages, Chips & Snacks",Breakfast Bars & Pastries,Pastries,Kellogg's,Kellogg's Pop Tarts Gone Nutty! Breakfast Toaster Pastries Frosted Chocolate Peanut Butter,,2.49,0,17667.jpg,,10.5,oz,,5
"Beverages, Chips & Snacks",Breakfast Bars & Pastries,Pastries,Kellogg's,Kellogg's Pop Tarts Whole Grain Frosted Brown Sugar Cinnamon Toaster Pastries,,2.49,0,6197.jpg,,14.1,oz,,5
"Beverages, Chips & Snacks",Breakfast Bars & Pastries,Other Pastries,Kellogg's,Kellogg's Special K Brown Sugar Cinnamon Pastry Crisps,,3.09,0,6196.jpg,,4.4,oz,,
"Beverages, Chips & Snacks",Breakfast Bars & Pastries,Other Pastries,Kellogg's,Kellogg's Special K Chocolate Delight Protein Breakfast Shakes,,7.39,0,6200.jpg,,4,x 10 fl oz,,
"Beverages, Chips & Snacks",Breakfast Bars & Pastries,Other Pastries,Kellogg's,Kellogg's Special K French Vanilla Protein Breakfast Shakes,,6.09,0,6199.jpg,,4,x 10 fl oz,,
"Beverages, Chips & Snacks",Breakfast Bars & Pastries,Pastries,Market Basket,Market Basket Blueberry Toaster Pastries,,1.49,0,Market Basket.jpg,,6,ct,,5
"Beverages, Chips & Snacks",Breakfast Bars & Pastries,Pastries,Market Basket,Market Basket Strawberry Toaster Pastries,,1.49,0,Market Basket.jpg,,6,ct,,5
"Beverages, Chips & Snacks",Breakfast Bars & Pastries,Biscuits,Nabisco,Nabisco Belvita Soft Baked Mixed Berry Breakfast Biscuits,,3.69,0,17661.jpg,,5,ct,,
"Beverages, Chips & Snacks",Breakfast Bars & Pastries,Other Pastries,Nature Valley,Nature Valley Soft Baked Oatmeal Squares Cinnamon Brown Sugar,,3.69,0,17662.jpg,,1.24,oz,,
"Beverages, Chips & Snacks",Breakfast Bars & Pastries,Pastries,Nature's Path,Nature's Path Frosted Cherry Pomegranate Toaster Pastries,,4.29,0,6240.jpg,,11,oz,,5
"Beverages, Chips & Snacks",Breakfast Bars & Pastries,Pastries,Nature's Path,Nature's Path Frosted Granny Apple Pie Toaster Pastries,,4.29,0,6238.jpg,,6,x 11 oz,,5
"Beverages, Chips & Snacks",Breakfast Bars & Pastries,Pastries,Nature's Path,Nature's Path NP Strawberry Unfrosted Pastries,,4.29,0,6241.jpg,,6,x 11 oz,,5
"Beverages, Chips & Snacks",Breakfast Bars & Pastries,Other Pastries,Rice Krispies,Rice Krispies Treats Crispy Marshmallow Squares Original,,4.89,0,17658.jpg,,16,x 0.78 oz,,
"Beverages, Chips & Snacks",Breakfast Bars & Pastries,Other Pastries,Rice Krispies,Rice Krispies Treats Crispy Marshmallow Squares Original,,9.79,0,17669.jpg,,40,Ct,,
Cooking Needs,Baking & Cooking,Baking Ingredients,Argo,Argo 100% Pure Corn Starch,,1.89,0,15694.jpg,,16,oz,,8
Cooking Needs,Baking & Cooking,Baking Ingredients,Arm & Hammer,Arm & Hammer Pure Baking Soda,,0.99,0,15674.jpg,,16,oz,,8
Cooking Needs,Baking & Cooking,Baking Ingredients,Armour,Armour Lard,,2.09,0,15730.jpg,,16,oz,,8
Cooking Needs,Baking & Cooking,Baking Ingredients,Baker's,Baker's Angel Flake Sweetened Coconut,,2.49,0,15713.jpg,,7,oz,,8
Cooking Needs,Baking & Cooking,Baking Ingredients,Baker's,"Baker's Premium Baking Chocolate Bar, Semi Sweet 56% Cacao",,2.49,0,15708.jpg,,4,oz,,8
Cooking Needs,Baking & Cooking,Baking Ingredients,Baker's,Baker's Sweetened German's Chocolate Baking Bar,,2.79,0,15721.jpg,,4,oz,,8
Cooking Needs,Baking & Cooking,Baking Ingredients,Baker's,Baker's Unsweetened 100% Cacao Baking Chocolate Bar,,2.49,0,15725.jpg,,8,oz,,8
Cooking Needs,Baking & Cooking,Baking Ingredients,Bob's Red Mill,Bob's Red Mill 'Sweet' White Sorghum Flour,,4.89,0,2298.jpg,,22,oz,,8
Cooking Needs,Baking & Cooking,Baking Ingredients,Bob's Red Mill,"Bob's Red Mill 1 to 1 Baking Flour, Gluten/Wheat/Dairy Free",,10.99,0,2315.jpg,,44,oz,,8
Cooking Needs,Baking & Cooking,Baking Ingredients,Bob's Red Mill,"Bob's Red Mill Bobs Red Mill Nutritional Yeast, Large Flake, Pouch",,6.09,0,2301.jpg,,5,oz,,8
Cooking Needs,Baking & Cooking,Baking Ingredients,Bob's Red Mill,Bob's Red Mill Brown Rice Flour,,4.29,0,2308.jpg,,24,oz,,8
Cooking Needs,Baking & Cooking,Baking Ingredients,Bob's Red Mill,Bob's Red Mill Coarse Grain Cornmeal,,3.29,0,2312.jpg,,24,oz,,8
Cooking Needs,Baking & Cooking,Baking Ingredients,Bob's Red Mill,Bob's Red Mill Coconut Shredded Unsweetened,,4.69,0,2300.jpg,,12,oz,,8
Cooking Needs,Baking & Cooking,Baking Ingredients,Bob's Red Mill,Bob's Red Mill Finely Ground Almond Flour,,10.99,0,2309.jpg,,16,oz,,8
Cooking Needs,Baking & Cooking,Baking Ingredients,Bob's Red Mill,Bob's Red Mill Gluten Free All Purpose Baking Flour,,12.19,0,2293.jpg,,44,oz,,8
Cooking Needs,Baking & Cooking,Baking Ingredients,Bob's Red Mill,Bob's Red Mill Gluten Free All Purpose Baking Flour,,4.89,0,2318.jpg,,22,oz,,8
Cooking Needs,Baking & Cooking,Baking Ingredients,Bob's Red Mill,Bob's Red Mill Gluten Free Biscuit & Baking Mix,,5.49,0,2294.jpg,,24,oz,,8
Cooking Needs,Baking & Cooking,Baking Ingredients,Bob's Red Mill,Bob's Red Mill Gluten Free Tapioca Flour,,4.89,0,2304.jpg,,20,oz,,8
Cooking Needs,Baking & Cooking,Baking Ingredients,Bob's Red Mill,Bob's Red Mill Organic Golden Flaxseed Meal,,3.69,0,2306.jpg,,16,oz,,8
Cooking Needs,Baking & Cooking,Baking Ingredients,Bob's Red Mill,Bob's Red Mill Organic High Fiber Coconut Flour,,7.39,0,2302.jpg,,16,oz,,8
Cooking Needs,Baking & Cooking,Baking Ingredients,Bob's Red Mill,Bob's Red Mill Pie Crust Gluten Free,,4.29,0,2296.jpg,,16,oz,,8
Cooking Needs,Baking & Cooking,Baking Ingredients,Bob's Red Mill,Bob's Red Mill Potato Starch Unmodified,,4.89,0,2295.jpg,,24,oz,,8
Cooking Needs,Baking & Cooking,Baking Ingredients,Emeril's,Emeril's Original Canola Oil Cooking Spray,,3.69,0,15678.jpg,,6,oz,,8
Cooking Needs,Baking & Cooking,Baking Ingredients,Equal,Equal Original 0 Calorie Sweetener Packets,,4.89,0,15738.jpg,,115,count,,8
Cooking Needs,Baking & Cooking,Baking Ingredients,Goya,Goya Extra Fine Yellow Corn Meal,,1.89,0,2351.jpg,,24,oz,,8
Cooking Needs,Baking & Cooking,Baking Ingredients,Fisher,Fisher Walnut Halves & Pieces,,7.99,0,15695.jpg,,16,oz,,8
Cooking Needs,Baking & Cooking,Baking Ingredients,Fisher,Fisher Walnuts Halves & Pieces,,5.49,0,15701.jpg,,10,oz,,8
Cooking Needs,Baking & Cooking,Baking Ingredients,Florida Crystals,Florida Crystals Organic Sugar Pure Florida Cane Sugar,,3.09,0,15702.jpg,,32,oz,,8
Cooking Needs,Baking & Cooking,Baking Ingredients,Florida Crystals,Florida Crystals Raw Cane Sugar,,3.09,0,15716.jpg,,2,lb,,8
Cooking Needs,Baking & Cooking,Baking Ingredients,Ghirardelli Chocolate,Ghirardelli Chocolate 60% Cacao Bittersweet Chocolate Premium Baking Bar,,2.79,0,2346.jpg,,4,oz,,8
Cooking Needs,Baking & Cooking,Baking Ingredients,Ghirardelli Chocolate,Ghirardelli Chocolate Baking Chips 60% Cacao Bittersweet,,4.19,0,2342.jpg,,10,oz,,8
Cooking Needs,Baking & Cooking,Baking Ingredients,Ghirardelli Chocolate,Ghirardelli Chocolate Baking Chips Classic White,,3.69,0,2340.jpg,,11,oz,,8
Cooking Needs,Baking & Cooking,Baking Ingredients,Ghirardelli Chocolate,Ghirardelli Chocolate Baking Chips Semi Sweet Chocolate,,3.69,0,2341.jpg,,12,oz,,8
Cooking Needs,Baking & Cooking,Baking Ingredients,Ghirardelli Chocolate,Ghirardelli Chocolate Chocolate Premium Baking Bar 100% Cacao Unsweetened Chocolate,,2.79,0,2345.jpg,,4,oz,,8
Cooking Needs,Baking & Cooking,Baking Ingredients,Ghirardelli Chocolate,Ghirardelli Chocolate Chocolate Premium Baking Bar Semi Sweet Chocolate,,2.79,0,2339.jpg,,4,oz,,8
Cooking Needs,Baking & Cooking,Baking Ingredients,Ghirardelli Chocolate,Ghirardelli Chocolate Mini Baking Chips Semi Sweet Chocolate,,3.69,0,2343.jpg,,10,oz,,8
Cooking Needs,Baking & Cooking,Baking Ingredients,Gold Medal,Gold Medal Self Rising Flour,,4.29,0,17971.jpg,,5,lb,,8
Cooking Needs,Canned Food,Canned & Jarred Vegetables,Amore,Garlic Paste,,4.89,0,17103.jpg,,3.2,oz,,9
Cooking Needs,Canned Food,Canned & Jarred Vegetables,Amore,Tomato Paste,,3.09,0,17100.jpg,,4.5,oz,,9
Cooking Needs,Canned Food,Canned & Jarred Vegetables,Botticelli,Fire Roasted Sweet Red Peppers,,1.89,0,17111.jpg,,12,oz,,9
Cooking Needs,Canned Food,Canned & Jarred Vegetables,Bruce's,Bruce's Yams Cut Sweet Potatoes in Syrup,,1.59,0,17104.jpg,,15,oz,,9
Cooking Needs,Canned Food,Canned & Jarred Vegetables,Bruce's,Bruce's Yams Whole Sweet Potatoes In Syrup,,1.89,0,17108.jpg,,16,oz,,9
Cooking Needs,Canned Food,Canned & Jarred Vegetables,Bush's Best,Bush's Best Chili Beans Black Beans Mild Chili Sauce,,1.29,0,17099.jpg,,15.5,oz,,9
Cooking Needs,Canned Food,Canned & Jarred Vegetables,Cento,Cento All Purpose Crushed Tomatoes,,3.69,0,5081.jpg,,28,oz,,9
Cooking Needs,Canned Food,Canned & Jarred Vegetables,Cento,Cento Artichoke Hearts,,2.79,0,5080.jpg,,14,oz,,9
Cooking Needs,Canned Food,Canned & Jarred Vegetables,Cento,"Cento San Marzano Whole Peeled Tomatoes with Basil Leaf, Certified",,3.69,0,5079.jpg,,28,oz,,9
Cooking Needs,Canned Food,Canned & Jarred Vegetables,Cento,Cento Tomato Paste,,0.69,0,5078.jpg,,6,oz,,9
Cooking Needs,Canned Food,Canned & Jarred Vegetables,Cento,Cento Tomato Puree,,3.69,0,5082.jpg,,28,oz,,9
Cooking Needs,Canned Food,Canned & Jarred Vegetables,CHI-CHI'S,Chi Chi's Diced Fiesta Green Chilis,,1.29,0,No Image.jpg,,4,oz,,9
Cooking Needs,Canned Food,Canned & Jarred Vegetables,Contadina,Contadina Crushed Tomatoes in Tomato Puree,,1.89,0,5076.jpg,,28,oz,,9
Cooking Needs,Canned Food,Canned & Jarred Vegetables,Contadina,Contadina Roma Style Tomatoes Crushed with Italian Herbs,,1.89,0,5074.jpg,,28,oz,,9
Cooking Needs,Canned Food,Canned & Jarred Vegetables,Contadina,Contadina Sauce with Italian Herbs,,1.09,0,5073.jpg,,15,oz,,9
Cooking Needs,Canned Food,Canned & Jarred Vegetables,Contadina,Contadina Sauce with Natural Sea Salt,,1.09,0,5072.jpg,,15,oz,,9
Cooking Needs,Canned Food,Canned & Jarred Vegetables,Contadina,Contadina Tomato Paste,,1.29,0,5075.jpg,,6,oz,,9
Cooking Needs,Canned Food,Canned & Jarred Vegetables,Contadina,Contadina Tomato Paste,,1.89,0,5077.jpg,,12,oz,,9
