Category,Sub Catagory,Type,Brand,product,Product Description,Price,Tax,Image,Store,Size,UOM,Spice Level,Aisle No.
Fresh Produce,Fresh Organic Vegetables,Onion,Market Basket,Organic Onion,,4.24,0,14438.jpg,,32,oz,,20
Fresh Produce,Fresh Organic Vegetables,Onion,Market Basket,Organic Yellow Onion Bag,,3.78,0,14413.jpg,,2,lb bag,,20
Fresh Produce,Fresh Organic Vegetables,Pepper,Market Basket,Organic Mini Sweet Peppers,,6.99,0,14445.jpg,,1,oz,,20
Fresh Produce,Fresh Organic Vegetables,Roster Potato,Market Basket,Organic Gold Roaster Potato Bag,,6.31,0,14431.jpg,,5,lb bag,,20
Fresh Produce,Fresh Organic Vegetables,Russet Potato,Market Basket,Organic Russet Potatoes Bag,,6.31,0,14437.jpg,,5,lb,,20
Fresh Produce,Fresh Organic Vegetables,Shallots,Auerpak,Auerpak Organic Shallots,,2.86,0,32.jpg,,3,oz,,20
Fresh Produce,Fresh Organic Vegetables,Squash,Market Basket,Organic Kabocha Squash,,5.73,0,14444.jpg,,1,count,,20
Fresh Produce,Fresh Organic Vegetables,Squash,Market Basket,Organic Spaghetti Squash,,8.59,0,14392.jpg,,1,count,,20
Fresh Produce,Fresh Organic Vegetables,Sweet Potato,Market Basket,Barnes Farming Organic Sweet Potatoes,,3.21,0,14409.jpg,,3,lb bag,,20
Fresh Produce,Fresh Organic Vegetables,Sweet Potato,Market Basket,Organic Sweet Potato Bag,,1.48,0,14336.jpg,,7,oz bag,,20
Fresh Produce,Fresh Organic Vegetables,Tomato,Market Basket,Organic Greenhouse Grown Tomato,,5.62,0,FP121.jpg,,1,count,,20
Fresh Produce,Fresh Organic Vegetables,Tomato,Market Basket,Organic Stem Cluster Tomatoes (Approx: 8 ct),,4.24,0,FP124.jpg,,1,lb,,20
Fresh Produce,Fresh Organic Vegetables,Tomato,Market Basket,Sunset Organic Campari Tomatoes,,4.93,0,14318.jpg,,12,oz,,20
Fresh Produce,Fresh Organic Vegetables,White Mushroom,Monterey,Monterey Mushrooms Whole Organic White Mushrooms,,3.78,0,44.jpg,,8,oz container,,20
Meat & Seafood,Meat & Seafood Counter,Beef,85% Lean,85% Lean Beef Burgers,,8.59,0,No Image.jpg,,1,lb,,22
Meat & Seafood,Meat & Seafood Counter,Beef,85% Lean,85% Lean Ground Beef,,8.59,0,16673.jpg,,1,lb,,22
Meat & Seafood,Meat & Seafood Counter,Beef,Angus Beef,Angus Beef Boneless Chuck Eye Steak,,6.49,0,No Image.jpg,,1,lb,,22
Meat & Seafood,Meat & Seafood Counter,Beef,Ball Park,"Ball Park Fully-Cooked Flame Grilled Original Beef Patties, Frozen",,2.49,0,4050.jpg,,1,lb,,22
Meat & Seafood,Meat & Seafood Counter,Beef,Certified Angus Beef,Certified Angus Beef Boneless Chuck Stew,,8.09,0,16670.jpg,,1,lb,,22
Meat & Seafood,Meat & Seafood Counter,Beef,Certified Angus Beef,Certified Angus Beef Boneless Strip Steak,,12.19,0,4048.jpg,,1,lb,,22
Meat & Seafood,Meat & Seafood Counter,Beef,Certified Angus Beef,Certified Angus Beef Cap Off London Broil,,4.09,0,No Image.jpg,,1,lb,,22
Meat & Seafood,Meat & Seafood Counter,Beef,Certified Angus Beef,Certified Angus Beef First Cut Top Steak,,4.89,0,No Image.jpg,,1,lb,,22
Meat & Seafood,Meat & Seafood Counter,Beef,Certified Angus Beef,Certified Angus Beef Sirloin Tip Steak,,12.19,0,No Image.jpg,,1,lb,,22
Meat & Seafood,Meat & Seafood Counter,Beef,Certified Angus Beef,Certified Angus Beef Thin Boneless Chuck Steak,,6.69,0,No Image.jpg,,1,lb,,22
Meat & Seafood,Meat & Seafood Counter,Beef,Excel,Excel Beef Feet,,3.19,0,No Image.jpg,,Approx:,1.00 lb at $3.19/lb,,22
Meat & Seafood,Meat & Seafood Counter,Beef,Extra,93% Lean 7% Fat Extra Lean Beef Patties,,6.39,0,No Image.jpg,,1,lb,,22
Meat & Seafood,Meat & Seafood Counter,Beef,Kayem,Kayem Boston Red Sox Fenway Franks Beef,,4.89,0,16667.jpg,,1,lb,,22
Meat & Seafood,Meat & Seafood Counter,Beef,Market Basket,90% Ground Beef,,6.49,0,16665.jpg,,1,lb,,22
Meat & Seafood,Meat & Seafood Counter,Beef,Market Basket,90% Lean Ground Sirloin,,6.49,0,16664.jpg,,1,lb,,22
Meat & Seafood,Meat & Seafood Counter,Beef,Market Basket,Beef Boneless Eye Round Roast,,15.58,0,Market Basket.jpg,,Approx:,2.69 lb at $5.79/lb,,22
Meat & Seafood,Meat & Seafood Counter,Beef,Market Basket,Beef Franks,,4.29,0,Market Basket.jpg,,1,lb,,22
Meat & Seafood,Meat & Seafood Counter,Beef,Market Basket,Beef Oxtail,,13.41,0,Market Basket.jpg,,Approx:,1.37 lb at $9.79/lb,,22
Meat & Seafood,Meat & Seafood Counter,Beef,Market Basket,Beef Stock,,2.49,0,Market Basket.jpg,,1,lb,,22
Meat & Seafood,Meat & Seafood Counter,Beef,Market Basket,Boneless Beef Chuck,,4.89,0,Market Basket.jpg,,1,lb,,22
Meat & Seafood,Meat & Seafood Counter,Beef,Market Basket,Boneless Eye of Round Beef Steak,,6.09,0,Market Basket.jpg,,1,lb,,22
Meat & Seafood,Packaged Meat & Seafood,Bacon,Market Basket,Market Basket Center Cut Bacon,,4.29,0,Market Basket.jpg,,1,pack,,22
Meat & Seafood,Packaged Meat & Seafood,Beef,85% Lean,85% Lean Ground Beef,,4.59,0,16689.jpg,,1,lb,,22
Meat & Seafood,Packaged Meat & Seafood,Beef,Angus Beef,Angus Beef Xtra Lean Round Stew,,4.89,0,16690.jpg,,1,lb,,22
Meat & Seafood,Packaged Meat & Seafood,Beef,Certified Angus Beef,Certified Angus Beef Thin Top Round Steak,,5.79,0,No Image.jpg,,0.97,lb,,22
Meat & Seafood,Packaged Meat & Seafood,Beef,Creekstone Farm,Creekstone Farm Black Angus Ground Beef,,8.69,0,16705.jpg,,1,lb,,22
Meat & Seafood,Packaged Meat & Seafood,Beef,Lauras Beef,"Lauras Beef Beef, Ground, 92/8",,8.29,0,4089.jpg,,16,oz,,22
Meat & Seafood,Packaged Meat & Seafood,Beef,Lloyd's,Lloyd's Seasoned & Smoked Center Cut Beef Ribs with Original BBQ Sauce,,17.69,0,4091.jpg,,37.4,oz,,22
Meat & Seafood,Packaged Meat & Seafood,Beef,Market Basket,Boneless Rib Eye Steaks,,15.89,0,Market Basket.jpg,,1,lb,,22
Meat & Seafood,Packaged Meat & Seafood,Beef,Market Basket,Market Basket 80% Ground Beef,,4.89,0,4074.jpg,,4,lb,,22
Meat & Seafood,Packaged Meat & Seafood,Beef,Market Basket,Market Basket 85% Lean Angus Ground Beef,,5.29,0,4075.jpg,,1,pack,,22
Meat & Seafood,Packaged Meat & Seafood,Beef,Market Basket,Market Basket 93% Lean Ground Beef,,6.75,0,4073.jpg,,Approx:,1.23 lb at $5.49/lb,,22
Meat & Seafood,Packaged Meat & Seafood,Beef,Market Basket,Selected Thin Sliced NY Sirloin Petite,,6.09,0,Market Basket.jpg,,1,lb,,22
Meat & Seafood,Packaged Meat & Seafood,Beef,Verde,Verde 93% Lean | 7% Fat Organic Ground Beef,,9.79,0,16703.jpg,,16,oz,,22
Meat & Seafood,Packaged Meat & Seafood,Beef,York,Petite New York Sirloin,,11.49,0,No Image.jpg,,1,lb,,22
Meat & Seafood,Packaged Meat & Seafood,Bison,Great Range Buffalo,Great Range Buffalo Premium Ground Bison,,10.99,0,4087.jpg,,16,oz,,22
Meat & Seafood,Packaged Meat & Seafood,Calamari,PanaPesca,PanaPesca Whole Cleaned Calamari,,8.59,0,4140.jpg,,17.6,oz,,22
Meat & Seafood,Packaged Meat & Seafood,Chicken,Perdue,Perdue Carved Chicken BreastGrilled Italian Style,,3.49,0,4093.jpg,,0.56,lb,,22
Meat & Seafood,Packaged Meat & Seafood,Chicken,Perdue,Perdue Dino Shape Breaded Chicken Nuggets,,3.49,0,4092.jpg,,0.75,lb,,22
Meat & Seafood,Packaged Meat & Seafood,Chicken,Market Basket,Chicken,,6.09,0,Market Basket.jpg,,1,lb,,22
Meat & Seafood,Packaged Meat & Seafood,Chicken,Market Basket,Market Basket Fresh Roaster Whole Chicken,,5.56,0,Market Basket.jpg,,Approx:,4.00 lb at $1.39/lb,,22
Meat & Seafood,Packaged Meat & Seafood,Chicken,Market Basket,Market Basket Organic Chicken Stock,,1.29,0,Market Basket.jpg,,1,pack,,22
Meat & Seafood,Packaged Meat & Seafood,Chicken,Market Basket,Market Basket Stir Fry Chicken,,4.89,0,Market Basket.jpg,,Approx:,1.00 lb at $4.89/lb,,22
Meat & Seafood,Packaged Meat & Seafood,Chicken,Market Basket,Market Basket Whole Chicken Legs,,3.35,0,Market Basket.jpg,,Approx:,2.25 lb at $1.49/lb,,22
Meat & Seafood,Packaged Meat & Seafood,Chicken,Market Basket,Market Basket Whole Frozen Chicken Paws,,2.49,0,Market Basket.jpg,,Approx:,1.00 lb at $2.49/lb,,22
Meat & Seafood,Packaged Meat & Seafood,Chicken,On Cor,On Cor Clear Bags Chicken Nibblers,,6.09,0,16712.jpg,,36,oz,,22
Meat & Seafood,Packaged Meat & Seafood,Chicken,Perdue,Perdue Chicken Drumsticks,,3.19,0,4110.jpg,,1.5,lb,,22
Meat & Seafood,Packaged Meat & Seafood,Chicken,Perdue,Perdue Whole Chicken,,7.95,0,4105.jpg,,Approx:,5.00 lb at $1.59/lb,,22
Meat & Seafood,Packaged Meat & Seafood,Chicken,Perdue,Perdue Whole Roaster Chicken,,8.45,0,No Image.jpg,,Approx:,5.00 lb at $1.69/lb,,22
Meat & Seafood,Packaged Meat & Seafood,Chicken Breast,Fresh,Harvestland All Natural Fresh Chicken Breasts,,6.39,0,No Image.jpg,,1.16,lb,,22
Meat & Seafood,Packaged Meat & Seafood,Chicken Breast,Bell & Evans,Bell & Evans Boneless Chicken Breast,,9.19,0,4123.jpg,,1,lb,,22
Meat & Seafood,Packaged Meat & Seafood,Chicken Breast,Bell & Evans,Bell & Evans Boneless Skinless Chicken Breasts,,7.39,0,4122.jpg,,Approx:,2 lb,,22
Meat & Seafood,Packaged Meat & Seafood,Chicken Breast,Fresh,Perdue Fresh Chicken Breast,,4.59,0,No Image.jpg,,1,lb,,22
Meat & Seafood,Packaged Meat & Seafood,Chicken Breast,Harvestland,Harvestland Boneless Skinless Chicken Breast,,6.79,0,4119.jpg,,1,lb,,22
Meat & Seafood,Packaged Meat & Seafood,Chicken Breast,Harvestland,Harvestland Chicken Breast,,6.09,0,No Image.jpg,,1,lb,,22
Meat & Seafood,Packaged Meat & Seafood,Chicken Breast,Market Basket,Chicken Breasts,,8.19,0,Market Basket.jpg,,24,oz,,22
Meat & Seafood,Packaged Meat & Seafood,Chicken Breast,Market Basket,Market Basket Chicken Breast Cutlets,,5.84,0,4097.jpg,,1.2,lb,,22
Meat & Seafood,Packaged Meat & Seafood,Chicken Breast,Perdue,Perdue Boneless Chicken BreastsItalian Style,,8.59,0,4098.jpg,,1.5,lb,,22
Meat & Seafood,"Hot Dogs, Bacon & Sausage",Bacon,Alfresco,Alfresco Original Uncured Chicken Bacon,,3.69,0,4145.jpg,,14,count,,22
Meat & Seafood,"Hot Dogs, Bacon & Sausage",Bacon,Applegate,Applegate Natural Reduced Sodium Sunday Bacon,,6.69,0,4184.jpg,,8,oz,,22
Meat & Seafood,"Hot Dogs, Bacon & Sausage",Bacon,Applegate,Applegate Organic Turkey Bacon,,6.99,0,4185.jpg,,8,oz,,22
Meat & Seafood,"Hot Dogs, Bacon & Sausage",Bacon,Butterball,Butterball Every Day Original Fully Cooked Turkey Bacon,,3.49,0,16743.jpg,,3,oz,,22
Meat & Seafood,"Hot Dogs, Bacon & Sausage",Bacon,Coleman,Coleman Uncured Hickory Smoked Bacon,,9.19,0,4192.jpg,,0.75,lb,,22
Meat & Seafood,"Hot Dogs, Bacon & Sausage",Bacon,Farmland,Farmland Bacon,,4.69,0,18048.jpg,,16,oz,,22
Meat & Seafood,"Hot Dogs, Bacon & Sausage",Bacon,Hormel,Hormel Fully Cooked Original 100% Real Thick Cut Bacon,,4.39,0,16723.jpg,,2.52,oz,,22
Meat & Seafood,"Hot Dogs, Bacon & Sausage",Bacon,Hormel,Hormel Natural Hardwood Smoke Maple Bacon,,5.29,0,16736.jpg,,340,g,,22
Meat & Seafood,"Hot Dogs, Bacon & Sausage",Bacon,Hormel,Hormel Natural Hardwood Smoke Original Bacon,,5.79,0,16741.jpg,,16,oz,,22
Meat & Seafood,"Hot Dogs, Bacon & Sausage",Bacon,Hormel,Hormel Naturally Hardwood Smoked 97% Fat Free Canadian Bacon,,4.59,0,16722.jpg,,6,oz,,22
Meat & Seafood,"Hot Dogs, Bacon & Sausage",Bacon,Jennie-o,Jennie-O Turkey Bacon,,3.09,0,16727.jpg,,12,oz,,22
Meat & Seafood,"Hot Dogs, Bacon & Sausage",Bacon,Jones Dairy Farm,Jones Dairy Farm Canadian Bacon Hickory Smoked,,4.29,0,16730.jpg,,10,x 6 oz,,22
Meat & Seafood,"Hot Dogs, Bacon & Sausage",Bacon,Jones Dairy Farm,"Jones Dairy Farm Turkey Bacon, Cherrywood Smoked, Uncured",,4.09,0,16744.jpg,,8,oz,,22
Meat & Seafood,"Hot Dogs, Bacon & Sausage",Bacon,Market Basket,Marker Basket Bacon,,3.09,0,Market Basket.jpg,,1,pack,,22
Meat & Seafood,"Hot Dogs, Bacon & Sausage",Bacon,Market Basket,Market Basket Bacon Steak Cuts,,3.69,0,Market Basket.jpg,,1,pack,,22
Meat & Seafood,"Hot Dogs, Bacon & Sausage",Bacon,Market Basket,Market Basket Fully Cooked Bacon,,3.69,0,Market Basket.jpg,,2.1,oz,,22
Meat & Seafood,"Hot Dogs, Bacon & Sausage",Bacon,Market Basket,Market Basket Hickory Smoked Bacon,,4.89,0,Market Basket.jpg,,16,oz,,22
Meat & Seafood,"Hot Dogs, Bacon & Sausage",Bacon,Market Basket,Market Basket Hickory Smoked Bacon Regular Sliced,,4.89,0,Market Basket.jpg,,16,oz,,1
Meat & Seafood,"Hot Dogs, Bacon & Sausage",Bacon,Market Basket,Market Basket Lower Sodium Hickory Smoked Sliced Bacon,,4.89,0,Market Basket.jpg,,16,oz,,1
Meat & Seafood,"Hot Dogs, Bacon & Sausage",Bacon,Market Basket,Market Basket Thick Sliced Bacon,,6.69,0,Market Basket.jpg,,20,oz,,1
Meat & Seafood,"Hot Dogs, Bacon & Sausage",Bacon,Market Basket,Market Basket Thick Sliced Pepper Bacon,,6.69,0,Market Basket.jpg,,20,oz,,1
Meat & Seafood,"Hot Dogs, Bacon & Sausage",Bacon,Oscar Mayer,Oscar Mayer Bacon,,6.69,0,4159.jpg,,16,oz,,1
Meat & Seafood,"Hot Dogs, Bacon & Sausage",Bacon,Oscar Mayer,Oscar Mayer Center Cut Original Bacon,,6.09,0,4164.jpg,,12,oz,,1
Meat & Seafood,"Hot Dogs, Bacon & Sausage",Bacon,Oscar Mayer,Oscar Mayer Fully Cooked Bacon,,4.69,0,4158.jpg,,2.52,oz,,1
Meat & Seafood,"Hot Dogs, Bacon & Sausage",Bacon,Oscar Mayer,Oscar Mayer Hearty Thick Cut Bacon,,6.69,0,4160.jpg,,16,oz,,1
Meat & Seafood,"Hot Dogs, Bacon & Sausage",Bacon,Oscar Mayer,"Oscar Mayer Naturally Hardwood Smoked Bacon, Lower Sodium",,6.69,0,4166.jpg,,16,oz,,1
Meat & Seafood,"Hot Dogs, Bacon & Sausage",Bacon,Oscar Mayer,Oscar Mayer Turkey Bacon,,4.09,0,4168.jpg,,12,oz,,1
Meat & Seafood,Lunch Meat,Beef,Deli,Deli Style Roast Beef,,13.49,0,17273.jpg,,1,lb,,22
Meat & Seafood,Lunch Meat,Beef,Oscar Mayer,Oscar Mayer Beef Bologna,,3.89,0,5409.jpg,,8,oz,,22
Meat & Seafood,Lunch Meat,Chicken,Applegate,Applegate Natural Oven Roasted Chicken Breast,,5.29,0,5438.jpg,,7,oz,,22
Meat & Seafood,Lunch Meat,Chicken,Hillshire Farm,"Hillshire Farm Â® Bold Flavor Lunchmeat, Chipotle Chicken Breast",,4.89,0,5433.jpg,,8,oz,,22
Meat & Seafood,Lunch Meat,Chicken,Market Basket,Market Basket Oven Roasted Chicken Breast,,1.69,0,Market Basket.jpg,,1,lb,,22
Meat & Seafood,Lunch Meat,Chicken,Thin 'n Trim,Thin 'n Trim Thinly Sliced Buffalo Style Chicken Breast,,7.39,0,No Image.jpg,,Approx:,1.00 lb at $7.39/lb,,22
Meat & Seafood,Lunch Meat,Chicken,Waterhill Naturals,Waterhill Naturals Oven Roasted Chicken Breast,,4.89,0,17293.jpg,,6,oz,,22
Meat & Seafood,Lunch Meat,Chicken & Turkey,Butterball,Butterball Made W/Chicken & Turkey Bologna,,2.49,0,5456.jpg,,16,oz,,22
Meat & Seafood,Lunch Meat,Ham,Applegate,Applegate Organic Black Forest Ham,,6.09,0,5439.jpg,,6,oz,,22
Meat & Seafood,Lunch Meat,Ham,Applegate,Applegate Organic Slow Cooked Ham,,6.09,0,5441.jpg,,6,oz,,22
Meat & Seafood,Lunch Meat,Ham,Deli,"Deli Select Ultra Thin Sliced Lunchmeat, Smoked Ham, 16 oz.",,6.09,0,17280.jpg,,16,oz,,22
Meat & Seafood,Lunch Meat,Ham,Fresh,Oscar Mayer Deli Fresh Honey Ham,,4.09,0,5403.jpg,,9,oz,,22
Meat & Seafood,Lunch Meat,Ham,Fresh,Oscar Mayer Deli Fresh Honey Shaved Smoked Ham,,7.09,0,5414.jpg,,16,oz,,22
Meat & Seafood,Lunch Meat,Ham,Glen Rock,Glen Rock Boneless Smoked Ham,,6.27,0,No Image.jpg,,Approx:,1.70 lb at $3.69/lb,,22
Meat & Seafood,Lunch Meat,Ham,Hatfield,Hatfield Classic Boneless Ham Steak,,2.99,0,17278.jpg,,8,oz,,22
Meat & Seafood,Lunch Meat,Ham,Healthy Ones,Healthy Ones Black Forest Deli Thin-Sliced Ham,,3.69,0,17275.jpg,,7,oz,,22
Meat & Seafood,Lunch Meat,Ham,Healthy Ones,Healthy Ones Honey Deli Thin-Sliced Ham,,3.69,0,17289.jpg,,7,oz,,22
Meat & Seafood,Lunch Meat,Ham,Hillshire Farm,"Hillshire Farm Â® Ultra Thin Sliced Lunchmeat, Brown Sugar Ham",,8.59,0,5430.jpg,,16,oz,,22
Meat & Seafood,Lunch Meat,Ham,Hillshire Farm,"Hillshire Farm Ultra Thin Sliced Lunchmeat, Honey Ham",,4.59,0,5425.jpg,,9,oz,,22
Meat & Seafood,Lunch Meat,Ham,Hillshire Farm,"Hillshire Farm Ultra Thin Sliced Lunchmeat, Honey Ham",,6.09,0,5429.jpg,,16,oz,,22
Meat & Seafood,Lunch Meat,Ham,Hillshire Farm,"Hillshire Farm Ultra Thin Sliced Lunchmeat, Smoked Ham",,4.59,0,5431.jpg,,9,oz,,22
Meat & Seafood,Lunch Meat,Ham,Hormel,Hormel Cooked Deli Ham,,4.29,0,5445.jpg,,8,oz,,22
Meat & Seafood,Lunch Meat,Ham,Hormel,Hormel Natural Choice Honey Deli Ham,,4.29,0,5449.jpg,,8,oz,,22
Meat & Seafood,Lunch Meat,Ham,Jones Dairy Farm,Jones Dairy Farm Ham Steak Hickory Smoked,,4.09,0,17291.jpg,,7,oz,,22
Meat & Seafood,Lunch Meat,Ham,Leidy's,Leidy's Hardwood Smoked Premium Boneless Ham Steak,,3.18,0,No Image.jpg,,Approx:,0.65 lb at $4.89/lb,,22
Meat & Seafood,Lunch Meat,Ham,Leidy's,Leidy's Uncured Smoked Ham Steak,,4.29,0,No Image.jpg,,6,oz,,22
Meat & Seafood,Lunch Meat,Ham,Market Basket,Black Forest Ham,,7.39,0,17272.jpg,,1,lb,,22
Meat & Seafood,Lunch Meat,Ham,Market Basket,Market Basket Black Forest Smoked Ham,,3.69,0,Market Basket.jpg,,10,oz,,22
Meat & Seafood,Lunch Meat,Ham,Market Basket,"Market Basket Black Forest Smoked Ham, Tub",,6.79,0,Market Basket.jpg,,10,oz,,22
Meat & Seafood,Lunch Meat,Ham,Market Basket,Market Basket Boneless Ham Half,,11.07,0,Market Basket.jpg,,Approx:,3.00 lb at $3.69/lb,,22
Meat & Seafood,Lunch Meat,Ham,Market Basket,Market Basket Cooked Ham Zip Pack,,4.09,0,Market Basket.jpg,,16,oz,,22
Meat & Seafood,Canned Meat & Seafood,Canned Beef,Hormel,"Hormel Ground, Formed & Sliced Dried Beef",,4.59,0,5236.jpg,,5,oz,,2
Meat & Seafood,Canned Meat & Seafood,Canned Chicken,Hormel,Hormel Premium Chicken Breast in Water,,3.09,0,5239.jpg,,10,oz,,2
Meat & Seafood,Canned Meat & Seafood,Canned Ham,Hormel,Hormel Smoked Ham,,1.59,0,5237.jpg,,5,oz,,2
Meat & Seafood,Canned Meat & Seafood,Canned Turkey,Hormel,Hormel White & Dark Turkey in Water,,1.59,0,5238.jpg,,5,oz,,2
Meat & Seafood,Canned Meat & Seafood,Canned Sausage,Libby's,Libby's Chicken Vienna Sausage,,0.69,0,17157.jpg,,4.6,oz,,2
Meat & Seafood,Canned Meat & Seafood,Canned Sausage,Libby's,Libby's Vienna Sausage,,0.69,0,17152.jpg,,4.6,oz,,2
Meat & Seafood,Canned Meat & Seafood,Canned Chicken,Market Basket,Market Basket Chicken Cooking Stock No Msg Fat Free,,2.49,0,Market Basket.jpg,,32,oz,,2
Meat & Seafood,Canned Meat & Seafood,Canned Chicken,Market Basket,Market Basket Chunk White Chicken In Water,,2.49,0,Market Basket.jpg,,12.5,oz,,2
Meat & Seafood,Canned Meat & Seafood,Other Meat,Spam,Spam 25% Less Sodium Canned Meat,,3.09,0,17148.jpg,,12,oz,,2
Meat & Seafood,Canned Meat & Seafood,Other Meat,Spam,Spam Classic Canned Meat,,3.19,0,17147.jpg,,340,g,,2
Meat & Seafood,Canned Meat & Seafood,Other Meat,Spam,Spam Lite Canned Meat,,3.09,0,17149.jpg,,12,oz,,2
Meat & Seafood,Canned Meat & Seafood,Canned Chicken,SwansonÂ®,SwansonÂ® Â Premium White Chunk Chicken Breast,,2.09,0,17151.jpg,,4.5,oz,,2
Meat & Seafood,Canned Meat & Seafood,Canned Chicken,Willow Tree Poultry Farm,Willow Tree Poultry Farm Chicken Salad Premium White Meat Classic,,6.09,0,17153.jpg,,15,oz,,2
Meat & Seafood,Canned Meat & Seafood,Other Seafood,Bar Harbor,Bar Harbor All Natural Smoked Wild Kippers,,3.09,0,5248.jpg,,6.7,oz,,2
Meat & Seafood,Canned Meat & Seafood,Canned Clams,Bar Harbor,Bar Harbor Chopped Clams,,2.49,0,5250.jpg,,6.5,oz,,2
Meat & Seafood,Canned Meat & Seafood,Other Seafood,Bar Harbor,"Bar Harbor Wild Herring Fillets, Seasoned with Cracked Pepper",,3.09,0,5249.jpg,,6.7,oz,,2
Meat & Seafood,Canned Meat & Seafood,Canned Sardines,Brunswick,Brunswick in Soybean Oil Sardines,,1.09,0,17158.jpg,,3.75,oz,,2
Meat & Seafood,Canned Meat & Seafood,Canned Tuna,Bumble Bee,Bumble Bee Chunk Light Tuna In Water,,1.29,0,5187.jpg,,5,oz,,2
Meat & Seafood,Canned Meat & Seafood,Canned Crabmeat,Bumble Bee,Bumble Bee Fancy Lump Crabmeat,,4.89,0,5191.jpg,,6,oz,,2
Meat & Seafood,Frozen Meat & Seafood,Chicken Products,Alfresco,Alfresco All Natural Chicken Meatballs Tomato & Basil,,7.39,0,16046.jpg,,12,oz,,18
Meat & Seafood,Frozen Meat & Seafood,Chicken Products,Applegate,Applegate Natural Chicken & Maple Breakfast Sausage Patty,,5.29,0,16029.jpg,,6,count,,18
Meat & Seafood,Frozen Meat & Seafood,Beef & Bacon Products,Ball Park,"Ball Park Fully-Cooked Flame Grilled Beef with Cheese & Bacon Patties, 6 Count",,9.29,0,2919.jpg,,16.2,oz,,18
Meat & Seafood,Frozen Meat & Seafood,Chicken Products,Bell & Evans,Bell & Evans All Natural Chicken Burgers,,7.39,0,2901.jpg,,4,count,,18
Meat & Seafood,Frozen Meat & Seafood,Chicken Products,Bell & Evans,"Bell & Evans Chicken Breast Tenders, Gluten Free",,7.39,0,2900.jpg,,12,oz,,18
Meat & Seafood,Frozen Meat & Seafood,Chicken Products,Bell & Evans,Bell & Evans Gluten Free Breaded Chicken Breast,,7.39,0,2902.jpg,,10.5,oz,,18
Meat & Seafood,Frozen Meat & Seafood,Chicken Products,Bell & Evans,Bell & Evans Uncooked Chicken Breast Nuggets Breaded,,7.39,0,2899.jpg,,12,oz,,18
Meat & Seafood,Frozen Meat & Seafood,Chicken Products,Bell & Evans,Bell & Evans Uncooked Chicken Patties Breaded,,7.39,0,16031.jpg,,16,oz,,18
Meat & Seafood,Frozen Meat & Seafood,Chicken Products,Birds Eye,Birds Eye Voila! Three Cheese Chicken,,4.89,0,16035.jpg,,21,oz,,18
Meat & Seafood,Frozen Meat & Seafood,Other Frozen Meat,Bove's ,Bove's Of Vermont Italian Style Meatballs,,6.99,0,16054.jpg,,16,oz,,18
Meat & Seafood,Frozen Meat & Seafood,Other Frozen Meat,Bubba,Bubba Burger Original Chuck Gluten Free Burgers,,20.79,0,16047.jpg,,6,count,,18
Meat & Seafood,Frozen Meat & Seafood,Turkey Products,Butterball,Butterball Original Seasoned Turkey Burgers,,8.59,0,2912.jpg,,32,oz,,18
Meat & Seafood,Frozen Meat & Seafood,Ham,Carando,Carando Spiral Cut Half Ham,,36.95,0,No Image.jpg,,Approx:,5.00 lb at $7.39/lb,,18
Meat & Seafood,Frozen Meat & Seafood,Other Frozen Meat,Fastbites,Fastbites Cheeseburger,,1.29,0,No Image.jpg,,4.9,oz,,18
Meat & Seafood,Frozen Meat & Seafood,Other Frozen Meat,Gardein,Gardein Black Bean Burger Chipotle,,4.89,0,16051.jpg,,12,oz,,18
Meat & Seafood,Frozen Meat & Seafood,Chicken Products,Harvestland,Harvestland Boneless Chicken Breasts,,12.19,0,16040.jpg,,2.25,lb,,18
Meat & Seafood,Frozen Meat & Seafood,Turkey Products,Jennie-o,Jennie-o Homestyle Turkey Meatballs,,6.49,0,16039.jpg,,24,oz,,18
Meat & Seafood,Frozen Meat & Seafood,Turkey Products,Jennie-o,Jennie-O Italian Style Turkey Meatballs,,6.49,0,16049.jpg,,24,oz,,18
Meat & Seafood,Frozen Meat & Seafood,Other Frozen Meat,Johnsonville,Johnsonville Italian (101752) Sausage Slices,,5.49,0,16048.jpg,,20,oz,,18
Meat & Seafood,Frozen Meat & Seafood,Chicken Products,Jones Dairy Farm,Jones Dairy Farm Golden Brown All Natural Fully Cooked Chicken Sausage Links,,2.49,0,16045.jpg,,10,count,,18
Meat & Seafood,Frozen Meat & Seafood,Turkey Products,Jones Dairy Farm,Jones Dairy Farm Jones Little Turkey Sausages - 12 CT,,3.69,0,16050.jpg,,10,oz,,18
Meat & Seafood,Frozen Meat & Seafood,Ham,Kentucky Legend,"Kentucky Legend Ham Steak, 45% Lower Sodium",,2.69,0,17981.jpg,,8,oz,,18
Meat & Seafood,Frozen Meat & Seafood,Beef Products,Market Basket,Market Basket Beef Shaved Steak,,6.31,0,Market Basket.jpg,,Approx:,1.09 lb at $5.79/lb,,18
Meat & Seafood,Frozen Meat & Seafood,Frozen Meat,Market Basket,Market Basket Duck,,60.52,0,Market Basket.jpg,,Approx:,16.4 lb at $3.69/lb,,18
Meat & Seafood,Frozen Meat & Seafood,Turkey Products,Market Basket,Market Basket Prime Frozen Turkey,,0.89,0,Market Basket.jpg,,1,lb,,18
Meat & Seafood,Frozen Meat & Seafood,Ham,Market Basket,Market Basket Spiral Cut Half Ham,,25.60,0,Market Basket.jpg,,Approx:,10.7 lb at $2.39/lb,,18
"Beverages, Chips & Snacks",Chips & Snacks,Cookies & Cakes,Market Basket,Market Basket Fudge Marshmellow Cookies ,,3.13,0,Market Basket.jpg,,12,oz,,6
"Beverages, Chips & Snacks",Chips & Snacks,Chips & Pretzels,Bachman,Bachman Bite Size Mini Baked Pretzels,,3.91,0,14862.jpg,,16,oz,,0
"Beverages, Chips & Snacks",Chips & Snacks,Chips & Pretzels,Bachman,Bachman Jax Cheddar Cheese Puffed Curls,,4.69,0,14848.jpg,,9.75,oz,,0
"Beverages, Chips & Snacks",Chips & Snacks,Chips & Pretzels,Bachman,Bachman Pretzel Stix,,3.91,0,14828.jpg,,6,x 1 oz,,0
"Beverages, Chips & Snacks",Chips & Snacks,Chips & Pretzels,Bachman,Bachman Pretzel Stix Brick Oven Flame Baked,,3.91,0,14837.jpg,,12,oz,,0
"Beverages, Chips & Snacks",Chips & Snacks,Chips & Pretzels,Bachman,Bachman Rolled Rods Flame Baked Pretzels,,3.91,0,14905.jpg,,10,oz,,0
"Beverages, Chips & Snacks",Chips & Snacks,Chips & Pretzels,Bachman,Bachman Thin'n Right Baked Pretzels,,3.91,0,14903.jpg,,9,oz,,0
"Beverages, Chips & Snacks",Chips & Snacks,Chips & Pretzels,Cape Cod,Cape Cod 40% Reduced Fat Potato Chips,,5.92,0,919.jpg,,8,x 0.75 oz,,0
"Beverages, Chips & Snacks",Chips & Snacks,Chips & Pretzels,Cape Cod,Cape Cod Kettle Cooked Aged Cheddar & Sour Cream Potato Chips 40% Reduced Fat,,5.92,0,921.jpg,,8,oz,,0
"Beverages, Chips & Snacks",Chips & Snacks,Chips & Pretzels,Cape Cod,Cape Cod Kettle Cooked Original Potato Chips,,5.92,0,925.jpg,,8,oz,,0
"Beverages, Chips & Snacks",Chips & Snacks,Chips & Pretzels,Cape Cod,Cape Cod Kettle Cooked Original Reduced Fat Potato Chips Party Size,,6.23,0,927.jpg,,14,oz,,0
"Beverages, Chips & Snacks",Chips & Snacks,Chips & Pretzels,Cape Cod,Cape Cod Kettle Cooked Potato Chips Dark Russet,,5.92,0,17919.jpg,,7.5,oz,,0
"Beverages, Chips & Snacks",Chips & Snacks,Chips & Pretzels,Cape Cod,Cape Cod Kettle Cooked Potato Chips Sweet Mesquite Barbeque,,5.92,0,924.jpg,,8,oz,,0
"Beverages, Chips & Snacks",Chips & Snacks,Chips & Pretzels,Cape Cod,"Cape Cod Potato Chips, Less Fat Sea Salt & Vinegar Kettle Cooked Chips",,5.92,0,917.jpg,,8,oz,,0
"Beverages, Chips & Snacks",Chips & Snacks,Chips & Pretzels,Cape Cod,"Cape Cod Potato Chips, Original Kettle Cooked Chips",,6.23,0,915.jpg,,14,oz,,0
"Beverages, Chips & Snacks",Chips & Snacks,Chips & Pretzels,Cape Cod,"Cape Cod Potato Chips, Original Kettle Cooked Chips",,5.92,0,920.jpg,,8,oz,,0
"Beverages, Chips & Snacks",Chips & Snacks,Chips & Pretzels,Cape Cod,"Cape Cod Potato Chips, Reduced Fat Original Kettle Cooked Chips",,6.23,0,914.jpg,,14,oz,,0
"Beverages, Chips & Snacks",Chips & Snacks,Chips & Pretzels,Cape Cod,"Cape Cod Potato Chips, Reduced Fat Original Kettle Cooked Chips",,5.92,0,923.jpg,,8,oz,,0
"Beverages, Chips & Snacks",Chips & Snacks,Chips & Pretzels,Cape Cod,"Cape Cod Potato Chips, Sweet & Spicy Jalapeno Kettle Cooked Chips",,5.92,0,918.jpg,,8,oz,,0
"Beverages, Chips & Snacks",Chips & Snacks,Chips & Pretzels,Cape Cod,Cape Cod Lightly Salted 60% Less Sodium,,5.92,0,bcs0002.jpg,,8,oz,,0
"Beverages, Chips & Snacks",Chips & Snacks,Chips & Pretzels,Cape Cod,Cape Cod Sea Salt & Cracked Pepper ,,5.92,0,bcs0003.jpg,,8,oz,,0
"Beverages, Chips & Snacks",Chips & Snacks,Chips & Pretzels,Cape Cod,Cape Cod Sea Salt & Vinegar,,5.92,0,bcs0004.jpg,,8,oz,,0
"Beverages, Chips & Snacks",Chips & Snacks,Chips & Pretzels,Cape Cod,Cape Cod Party Size Waffle Cut Sea Salt ,,6.23,0,bcs0005.jpg,,14,oz,,0
"Beverages, Chips & Snacks",Chips & Snacks,Chips & Pretzels,Cheetos,Cheetos Crunchy Cheese Flavored Snacks,,6.23,0,14850.jpg,,8.5,oz,,0
