"Product Id","Category","Sub Category","Type","Brand","Product Name","UPC Code","Product Description","Price","Tax","Store","Size","UOM","Image","Spice Level","Aisle No."
"5954","Beverages & Juices","Cocoa & Drink Mixes","Cocoa & Drink Mixes","Mr & Mrs T","Mr & Mrs T Bold & Spicy Bloody Mary Mix","","Mr & Mrs T Bold & Spicy Bloody Mary Mix","4.99","0.0","Market Basket","1 L","1 L","No Image.jpg","","17"
"5313","Chips, Cookies & Snacks","Cookies & Crackers","Cookies & Cakes","Oreo","Chocolate Creme Oreo Family Size","","Chocolate Creme Oreo Family Size","5.47","0.0","Market Basket","566 g","566 g","No Image.jpg","","6"
"6326","Beverages & Juices","Soft Drinks & Seltzers","Soft Drinks","Polar","Polar Birch Beer Soda","","Polar Birch Beer Soda","1.49","0.0","Market Basket","1 L","1 L","No Image.jpg","","11"
"6352","Beverages & Juices","Soft Drinks & Seltzers","Soft Drinks","Polar","Polar Premium Club Soda","","Polar Premium Club Soda","1.49","0.0","Market Basket","1 L","1 L","No Image.jpg","","11"
"4560","Meat & Seafood","Lunch Meat","Other Meat","Veroni","Veroni Prosciutto","","Veroni Prosciutto","8.59","0.0","Market Basket","4 oz","4 oz","No Image.jpg","","22"
"521","Laundry & Paper Goods","Laundry","Laundry Detergent","Arm & Hammer","Arm & Hammer Clean& Simple Laundry Detergent Crisp Clean","","Arm & Hammer Clean& Simple Laundry Detergent Crisp Clean","9.99","1.0","Market Basket","122.5 fl oz","122.5 fl oz","No Image.jpg","","15"
"5223","Chips, Cookies & Snacks","Cookies & Crackers","Crackers","Nabisco","Nabisco Wheat Thins Crackers, Multigrain","","Nabisco Wheat Thins Crackers, Multigrain","3.91","0.0","Market Basket","8.5 oz","8.5 oz","No Image.jpg","","6"
"5999","Beverages & Juices","Energy & Sports Drinks","Energy & Sports Drinks","Monster","Monster Energy 10 Pack","","Monster Energy 10 Pack","19.36","0.0","Market Basket","10 x 16 fl oz","10 x 16 fl oz","No Image.jpg","","17"
"5305","Chips, Cookies & Snacks","Cookies & Crackers","Crackers","Nabisco","Nabisco Nilla Wafers","","Nabisco Nilla Wafers","5.14","0.0","Market Basket","11 oz","11 oz","No Image.jpg","","6"
"5248","Chips, Cookies & Snacks","Chips & Fruit Snacks","Ready Popcorn","LATE JULY","LATE JULY Sea Salt Organic Popcorn","","LATE JULY Sea Salt Organic Popcorn","4.69","0.0","Market Basket","4.4 oz","4.4 oz","No Image.jpg","","0"
"5885","Beverages & Juices","Cocoa & Drink Mixes","Cocoa & Drink Mixes","Tang","Tang Orange Mango Drink Mix","","Tang Orange Mango Drink Mix","3.36","0.0","Market Basket","19.7 oz","19.7 oz","No Image.jpg","","17"
"5335","Chips, Cookies & Snacks","Cookies & Crackers","Cookies & Cakes","belVita","belVita Bites Cinnamon Brown Sugar","","belVita Bites Cinnamon Brown Sugar","4.69","0.0","Market Basket","8.8 oz","8.8 oz","No Image.jpg","","6"
"6007","Beverages & Juices","Energy & Sports Drinks","Energy & Sports Drinks","Monster","Monster Energy Zero Ultra","","Monster Energy Zero Ultra","2.49","0.0","Market Basket","16 fl oz","16 fl oz","No Image.jpg","","17"
"4900","Chips, Cookies & Snacks","Chips & Fruit Snacks","Chips & Pretzels","PiratesBrands","Pirate's Booty Aged White Cheddar Rice and Corn Puffs Multi Pack","","Pirate's Booty Aged White Cheddar Rice and Corn Puffs Multi Pack","7.8","0.0","Market Basket","6 x 1 oz","6 x 1 oz","No Image.jpg","","0"
"5379","Chips, Cookies & Snacks","Cookies & Crackers","Crackers","Schar","Schar Gluten Free Cocoa Wafers","","Schar Gluten Free Cocoa Wafers","4.67","0.0","Market Basket","4.4 oz","4.4 oz","No Image.jpg","","6"
"5356","Chips, Cookies & Snacks","Cookies & Crackers","Crackers","Cheez-It","Cheez-it 12 Pack Extra Toasty","","Cheez-it 12 Pack Extra Toasty","6.23","0.0","Market Basket","12 oz","12 oz","No Image.jpg","","6"
"6128","Beverages & Juices","Soft Drinks & Seltzers","Soft Drinks","Fresca","Fresca Sparkling Soda Water Grapefruit Citrus Original","","Fresca Sparkling Soda Water Grapefruit Citrus Original","6.86","0.0","Market Basket","12 x 12 fl oz","12 x 12 fl oz","No Image.jpg","","17"
"6396","Beverages & Juices","Soft Drinks & Seltzers","Seltzer","Polar","Polar Seltzer Mango Limeade","","Polar Seltzer Mango Limeade","4.18","0.0","Market Basket","8 x 12 fl oz","8 x 12 fl oz","No Image.jpg","","11"
"578","Laundry & Paper Goods","Laundry","Fabric Softener","Downy","Downy WrinkleGuard Fabric Conditioner","","Downy WrinkleGuard Fabric Conditioner","6.86","1.0","Market Basket","740 ml","740 ml","No Image.jpg","","15"
"5230","Chips, Cookies & Snacks","Cookies & Crackers","Crackers","Nabisco","Nabisco Wheat Thins Crackers, reduced Fat","","Nabisco Wheat Thins Crackers, reduced Fat","4.69","0.0","Market Basket","14.5 oz","14.5 oz","No Image.jpg","","6"
"5400","Chips, Cookies & Snacks","Cookies & Crackers","Crackers","Back to Nature","Back to Nature Chocolate Chunk Cookies","","Back to Nature Chocolate Chunk Cookies","6.23","0.0","Market Basket","9.5 oz","9.5 oz","No Image.jpg","","6"
"5358","Chips, Cookies & Snacks","Cookies & Crackers","Crackers","Nabisco","Nabisco Mini Chips Ahoy! 12 Packs","","Nabisco Mini Chips Ahoy! 12 Packs","6.23","0.0","Market Basket","12 x 1 oz","12 x 1 oz","No Image.jpg","","6"
"89","Kitchen & Cleaning","Cleaning Products","All Purpose Cleaner","Fresh 'n Clean","Fresh 'n Clean All Purpose Pine Cleaner","","Fresh 'n Clean All Purpose Pine Cleaner","1.29","1.0","Market Basket","28 fl oz","28 fl oz","No Image.jpg","","15"
"6325","Beverages & Juices","Soft Drinks & Seltzers","Soft Drinks","Polar","Polar Root Beer Soda","","Polar Root Beer Soda","1.49","0.0","Market Basket","1 L","1 L","No Image.jpg","","11"
"5321","Chips, Cookies & Snacks","Cookies & Crackers","Cookies & Cakes","Chips Ahoy!","Chips Ahoy! Chewy Reese's Peanut Butter Cups Cookies","","Chips Ahoy! Chewy Reese's Peanut Butter Cups Cookies","3.91","0.0","Market Basket","9.5 oz","9.5 oz","No Image.jpg","","6"
"6042","Beverages & Juices","Juices & Refrigerated Drinks","Juice & Nectars","Rose's","Rose's Grenadine Syrup","","Rose's Grenadine Syrup","3.74","0.0","Market Basket","12 fl oz","12 fl oz","No Image.jpg","","17"
"5318","Chips, Cookies & Snacks","Cookies & Crackers","Cookies & Cakes","Oreo","Oreo Carrot Cake Flavored Cookie Family Size","","Oreo Carrot Cake Flavored Cookie Family Size","5.47","0.0","Market Basket","482 g","482 g","No Image.jpg","","6"
"552","Laundry & Paper Goods","Laundry","Fabric Softener","Gain","Gain fabric Softener original 60 Loads","","Gain fabric Softener original 60 Loads","6.86","1.0","Market Basket","1.53 L","1.53 L","No Image.jpg","","15"
"489","Laundry & Paper Goods","Laundry","Laundry Detergent","Purex","Purex 4 in 1 Pacs Mountain Breeze 58 pack Laundry Detergent","","Purex 4 in 1 Pacs Mountain Breeze 58 pack Laundry Detergent","9.99","1.0","Market Basket","58 pack","58 pack","No Image.jpg","","15"
"411","Laundry & Paper Goods","Paper Goods","Bathroom Tissues / Toilet Paper","Scott","Scott Comfort Plus unscented bathroom tissue","","Scott Comfort Plus unscented bathroom tissue","7.49","1.0","Market Basket","12 count","12 count","No Image.jpg","","14"
"4437","Meat & Seafood","Hot Dogs, Bacon & Sausage","Hot Dogs","Meisterchef","Meisterchef Bologna","","Meisterchef Bologna","2.79","0.0","Market Basket","1 lb","1 lb","No Image.jpg","","1"
"484","Laundry & Paper Goods","Laundry","Laundry Detergent","Purex Liquid Detergents","Purex Natural Elements Linen & Lilies 115 Loads Laundry Detergent","","Purex Natural Elements Linen & Lilies 115 Loads Laundry Detergent","9.99","1.0","Market Basket","150 fl oz","150 fl oz","No Image.jpg","","15"
"5368","Chips, Cookies & Snacks","Cookies & Crackers","Cookies & Cakes","Homefree","Homefree Vanilla Mini Cookies","","Homefree Vanilla Mini Cookies","6.23","0.0","Market Basket","5 oz","5 oz","No Image.jpg","","6"
"5315","Chips, Cookies & Snacks","Cookies & Crackers","Cookies & Cakes","Oreo","Oreo Chocolate Marshmallow Cookies Family Size","","Oreo Chocolate Marshmallow Cookies Family Size","5.47","0.0","Market Basket","17 oz","17 oz","No Image.jpg","","6"
"4526","Meat & Seafood","Lunch Meat","Ham","Smithfield","Smithfield Sliced Hickory Smoked Boneless Ham","","Smithfield Sliced Hickory Smoked Boneless Ham","9.33","0.0","Market Basket","Approx: 2.28 lb at $4.09/lb","Approx: 2.28 lb at $4.09/lb","No Image.jpg","","22"
"562","Laundry & Paper Goods","Laundry","Laundry Detergent","Woolite","woolite Delicates 8 washes Laundry Detergent","","woolite Delicates 8 washes Laundry Detergent","6.24","1.0","Market Basket","16 fl oz","16 fl oz","No Image.jpg","","15"
"6412","Beverages & Juices","Water","Sparkling Water","Spindrift","Spindrift Sparkling Water Lime","","Spindrift Sparkling Water Lime","6.24","0.0","Market Basket","8 x 12 fl oz","8 x 12 fl oz","No Image.jpg","","11"
"6530","Chips, Cookies & Snacks","Nuts, Seeds & Dried Fruit","Nuts, Seeds & Dried Fruit","Sunmaid","Sunmaid California Sun-dried Raisins","","Sunmaid California Sun-dried Raisins","2.5","0.0","Market Basket","6 x 1 oz","6 x 1 oz","No Image.jpg","","6"
"5988","Beverages & Juices","Cocoa & Drink Mixes","Cocoa & Drink Mixes","Master of Mixes","Master of Mixes Classic Bloody Mary Mixer","","Master of Mixes Classic Bloody Mary Mixer","7.49","0.0","Market Basket","1.75 L","1.75 L","No Image.jpg","","17"
"8279","Condiments & Dressings","Fresh Dips & Tapenades","Fresh Dips & Tapenades","Cedar","Cedar Greek Style Yogurt Dip, Buffalo Bleu Cheese","","Cedar Greek Style Yogurt Dip, Buffalo Bleu Cheese","2.49","0.0","Market Basket","11 oz","11 oz","No Image.jpg","","1"
"6386","Beverages & Juices","Water","Sparkling Water","Polar","Polar Strawberry Watermelon Sparkling Water","","Polar Strawberry Watermelon Sparkling Water","1.24","0.0","Market Basket","1 L","1 L","No Image.jpg","","11"
"6315","Beverages & Juices","Water","Sparkling Water","Poland Spring","Poland Spring Sparkling Water, Orange Mango","","Poland Spring Sparkling Water, Orange Mango","3.74","0.0","Market Basket","8 x 12 fl oz","8 x 12 fl oz","No Image.jpg","","11"
"6095","Beverages & Juices","Soft Drinks & Seltzers","Soft Drinks","Coca-Cola","Coca Cola Zero Sugar Can","","Coca Cola Zero Sugar Can","4.16","0.0","Market Basket","6 x 12 fl oz","6 x 12 fl oz","No Image.jpg","","17"
"5997","Beverages & Juices","Energy & Sports Drinks","Energy & Sports Drinks","Monster","Monster Energy Ultra Sunrise 4 Pack","","Monster Energy Ultra Sunrise 4 Pack","8.74","0.0","Market Basket","4 x 16 fl oz","4 x 16 fl oz","No Image.jpg","","17"
"6191","Beverages & Juices","Ginger Ale & Ginger Beer","Ginger Ale","Schweppes","Schweppes Ginger Ale Box of Cans","","Schweppes Ginger Ale Box of Cans","9.99","0.0","Market Basket","24 x 12 fl oz","24 x 12 fl oz","No Image.jpg","","17"
"5001","Chips, Cookies & Snacks","Chips & Fruit Snacks","Chips & Pretzels","Utz","Utz Ripple Fried Dill Pickles Potato Chips","","Utz Ripple Fried Dill Pickles Potato Chips","4.69","0.0","Market Basket","9 oz","9 oz","No Image.jpg","","0"
"6123","Beverages & Juices","Soft Drinks & Seltzers","Soft Drinks","Fanta","Fanta Orange Zero Sugar","","Fanta Orange Zero Sugar","1.24","0.0","Market Basket","2 L","2 L","No Image.jpg","","17"
"6449","Chips, Cookies & Snacks","Jerkies","Jerky","Jack Link's","Jack Link's Teriyaki Beef Jerky","","Jack Link's Teriyaki Beef Jerky","4.99","0.0","Market Basket","2.85 oz","2.85 oz","No Image.jpg","","6"
"625","Laundry & Paper Goods","Paper Goods","Wipes","Scotties","Scotties everyday comfort","","Scotties everyday comfort","2.86","1.0","Market Basket","230 count","230 count","No Image.jpg","","14"
"12959","Breakfast & Dairy","Breads & Rolls","Tortillas & Flat Bread","Cinco De Mayo","Cinco De Mayo Corn Tortillas","","Cinco De Mayo Corn Tortillas","1.49","0.0","Market Basket","2 lb","2 lb","No Image.jpg","","18"
"14926","Personal Care","First Aid & Healthcare","Cold, Flu & Allergy","Equate","Equate Daytime Cold & Flu","","Equate Daytime Cold & Flu","3.55","1.0","Market Basket","1 pack","1 pack","No Image.jpg","","13"
"6371","Beverages & Juices","Water","Tonic Water","Polar","Polar Zero Sugar Tonic Water Traditional","","Polar Zero Sugar Tonic Water Traditional","1.49","0.0","Market Basket","1 L","1 L","No Image.jpg","","11"
"6453","Chips, Cookies & Snacks","Jerkies","Jerky","Matador","Matador Original Beef Jerky","","Matador Original Beef Jerky","6.86","0.0","Market Basket","3 oz","3 oz","No Image.jpg","","6"
"6311","Beverages & Juices","Water","Sparkling Water","Poland Spring","Poland Spring Sparkling Water, Raspberry Lime","","Poland Spring Sparkling Water, Raspberry Lime","3.74","0.0","Market Basket","8 x 16.9 fl oz","8 x 16.9 fl oz","No Image.jpg","","11"
"5276","Chips, Cookies & Snacks","Chips & Fruit Snacks","Chips & Pretzels","Good Health","Good Health Organic Baked Cheese Fries Cheddar","","Good Health Organic Baked Cheese Fries Cheddar","3.13","0.0","Market Basket","5.5 oz","5.5 oz","No Image.jpg","","0"
"6506","Chips, Cookies & Snacks","Nuts, Seeds & Dried Fruit","Nuts, Seeds & Dried Fruit","Blue Diamond","Blue Diamond Oven Roasted Almonds","","Blue Diamond Oven Roasted Almonds","9.99","0.0","Market Basket","16 oz","16 oz","No Image.jpg","","6"
"5972","Beverages & Juices","Cocoa & Drink Mixes","Cocoa & Drink Mixes","Master of Mixes","Master of Mixes Handcrafted Mango Daiquiri & Margarita Mixer","","Master of Mixes Handcrafted Mango Daiquiri & Margarita Mixer","4.99","0.0","Market Basket","33.8 fl oz","33.8 fl oz","No Image.jpg","","17"
"6148","Beverages & Juices","Soft Drinks & Seltzers","Soft Drinks","Mountain Dew","Mountain Dew Box of Cans","","Mountain Dew Box of Cans","9.99","0.0","Market Basket","24 x 12 fl oz","24 x 12 fl oz","No Image.jpg","","17"
"565","Laundry & Paper Goods","Laundry","Laundry Detergent","Persil","Persil ProClean plus Odor Fighter Detergent Deep Clean 20 Loads","","Persil ProClean plus Odor Fighter Detergent Deep Clean 20 Loads","7.49","1.0","Market Basket","40 fl oz","40 fl oz","No Image.jpg","","15"
"6234","Beverages & Juices","Water","Sparkling Water","Bubly","Bubly Sparkling Water Strawberry","","Bubly Sparkling Water Strawberry","4.18","0.0","Market Basket","8 x 12 fl oz","8 x 12 fl oz","No Image.jpg","","11"
"6009","Beverages & Juices","Energy & Sports Drinks","Energy & Sports Drinks","NOS","NOS High Performance Energy Drink 8 Pack","","NOS High Performance Energy Drink 8 Pack","12.49","0.0","Market Basket","8 x 16 fl oz","8 x 16 fl oz","No Image.jpg","","17"
"60","Kitchen & Cleaning","Air Fresheners & Candles","Candle","OW","OW Vanilla Candle","","OW Vanilla Candle","1.29","1.0","Market Basket","1 ct","1 ct","No Image.jpg","","12"
"6030","Beverages & Juices","Energy & Sports Drinks","Energy & Sports Drinks","Red Bull","Red Bull Peach Edition - Peach Nectarine","","Red Bull Peach Edition - Peach Nectarine","3.13","0.0","Market Basket","12 fl oz","12 fl oz","No Image.jpg","","17"
"4461","Meat & Seafood","Hot Dogs, Bacon & Sausage","Sausage","DiLuigi","DiLuigi Sweet Italian Chicken Sausage","","DiLuigi Sweet Italian Chicken Sausage","4.89","0.0","Market Basket","1 lb","1 lb","No Image.jpg","","1"
"6476","Chips, Cookies & Snacks","Nuts, Seeds & Dried Fruit","Nuts, Seeds & Dried Fruit","Superior Nut Company","Superior Nut Company Honey Roasted Almonds","","Superior Nut Company Honey Roasted Almonds","7.49","0.0","Market Basket","15 oz","15 oz","No Image.jpg","","6"
"6484","Chips, Cookies & Snacks","Nuts, Seeds & Dried Fruit","Nuts, Seeds & Dried Fruit","Teddie Premium Selection","Teddie Premium Selection Honey Roasted Extra Large Virginia Peanuts","","Teddie Premium Selection Honey Roasted Extra Large Virginia Peanuts","3.13","0.0","Market Basket","9 oz","9 oz","No Image.jpg","","6"
"5376","Chips, Cookies & Snacks","Cookies & Crackers","Crackers","Kinnikinnick","Kinnikinnick Mini Kritters","","Kinnikinnick Mini Kritters","6.23","0.0","Market Basket","8 oz","8 oz","No Image.jpg","","6"
"5007","Chips, Cookies & Snacks","Chips & Fruit Snacks","Chips & Pretzels","Utz","Utz The Crab Chip Potato Chips","","Utz The Crab Chip Potato Chips","4.69","0.0","Market Basket","9 oz","9 oz","No Image.jpg","","0"
"15114","Personal Care","Personal Needs","Facial Care","Olay","Olay Exfoliating Scrub, Deep Pore Clean, Out of This Swirled!","","Olay Exfoliating Scrub, Deep Pore Clean, Out of This Swirled!","9.19","1.0","Market Basket","5 oz","5 oz","No Image.jpg","","13"
"6045","Beverages & Juices","Juices & Refrigerated Drinks","Juice & Nectars","Kool-Aid","Kool Aid Grape","","Kool Aid Grape","3.36","0.0","Market Basket","19 oz","19 oz","No Image.jpg","","17"
"12979","Breakfast & Dairy","Breads & Rolls","Tortillas & Flat Bread","Pepito","Pepito Soft Taco Tortillas","","Pepito Soft Taco Tortillas","1.89","0.0","Market Basket","12 oz","12 oz","No Image.jpg","","7"
"6044","Beverages & Juices","Juices & Refrigerated Drinks","Juice & Nectars","Kool-Aid","Kool Aid Cherry","","Kool Aid Cherry","3.36","0.0","Market Basket","19 oz","19 oz","No Image.jpg","","17"
"14349","Breakfast & Dairy","Tea & Coffee","Coffee","Cafe Jose","Cafe Jose Tarrazu Reserve","","Cafe Jose Tarrazu Reserve","8.59","0.0","Market Basket","12 oz","12 oz","No Image.jpg","","8"
"5933","Beverages & Juices","Tea, Coffee, Milk & Coconut Water","Single To-Go Coffee","Twix","Twix Chocolate Lowfat Milk","","Twix Chocolate Lowfat Milk","3.74","0.0","Market Basket","14 fl oz","14 fl oz","No Image.jpg","","17"
"5017","Chips, Cookies & Snacks","Chips & Fruit Snacks","Chips & Pretzels","Utz","Utz Pork Rinds Chicharrones Original","","Utz Pork Rinds Chicharrones Original","3.11","0.0","Market Basket","5 oz","5 oz","No Image.jpg","","0"
"6270","Beverages & Juices","Water","Water","Glaceau","Glaceau Vapor Distilled Premium Water Bottle Alkaline","","Glaceau Vapor Distilled Premium Water Bottle Alkaline","9.99","0.0","Market Basket","6 x 1 L","6 x 1 L","No Image.jpg","","11"
"493","Laundry & Paper Goods","Laundry","Laundry Detergent","Tide","Tide Simply + OXI Refreshing Breeze 20 Loads Laundry Detergent","","Tide Simply + OXI Refreshing Breeze 20 Loads Laundry Detergent","4.36","1.0","Market Basket","31 fl oz","31 fl oz","No Image.jpg","","15"
"6376","Beverages & Juices","Water","Sparkling Water","Polar","Polar Lemon Sparkling Water","","Polar Lemon Sparkling Water","1.24","0.0","Market Basket","1 L","1 L","No Image.jpg","","11"
"5436","Chips, Cookies & Snacks","Candy & Chocolates","Candy & Chocolate","Drake's","Drake's Devil Dogs Creme Filled Devils Food Cakes","","Drake's Devil Dogs Creme Filled Devils Food Cakes","6.09","0.0","Market Basket","16 ct","16 ct","No Image.jpg","","18"
"367","Kitchen & Cleaning","Food Storage & Kitchen Supplies","Storage Containers","Ziploc","Ziploc S Square 4 Pk","","Ziploc S Square 4 Pk","3.49","1.0","Market Basket","4 count","4 count","No Image.jpg","","12"
"585","Laundry & Paper Goods","Laundry","Fabric Softener","Snuggle","Snuggle exhilarations island hibiscus & rainflower fabric conditioner","","Snuggle exhilarations island hibiscus & rainflower fabric conditioner","3.74","1.0","Market Basket","32 fl oz","32 fl oz","No Image.jpg","","15"
"592","Laundry & Paper Goods","Laundry","Fabric Softener","Final Touch","Final Touch Fabric Softener plus conditioner Spring Fresh 36 Loads","","Final Touch Fabric Softener plus conditioner Spring Fresh 36 Loads","2.74","1.0","Market Basket","72 fl oz","72 fl oz","No Image.jpg","","15"
"4282","Meat & Seafood","Packaged Meat & Seafood","Turkey","DiLuigi","Di Luigi Turkey Patties","","Di Luigi Turkey Patties","6.79","0.0","Market Basket","1.29 lb","1.29 lb","No Image.jpg","","22"
"6479","Chips, Cookies & Snacks","Nuts, Seeds & Dried Fruit","Nuts, Seeds & Dried Fruit","River Queen","River Queen Honey Roasted Peanuts","","River Queen Honey Roasted Peanuts","2.5","0.0","Market Basket","13 oz","13 oz","No Image.jpg","","6"
"6203","Beverages & Juices","Soft Drinks & Seltzers","Soft Drinks","7 up","7 Up Cherry Box of Cans","","7 Up Cherry Box of Cans","6.86","0.0","Market Basket","12 x 12 fl oz","12 x 12 fl oz","No Image.jpg","","17"
"8224","Condiments & Dressings","Marinades, Ketchup & Sauces","Condiments","Lavant","Lavant Tahina","","Lavant Tahina","3.09","0.0","Market Basket","16 oz","16 oz","No Image.jpg","","2"
"5995","Beverages & Juices","Energy & Sports Drinks","Energy & Sports Drinks","Gatorade","Gatorade Thirst Quencher Fruit Punch Powder Packs","","Gatorade Thirst Quencher Fruit Punch Powder Packs","3.74","0.0","Market Basket","8 x 1.24 oz","8 x 1.24 oz","No Image.jpg","","17"
"5371","Chips, Cookies & Snacks","Cookies & Crackers","Cookies & Cakes","Enjoy Life","Enjoy Life Soft Baked Cookies Snickerdoodle","","Enjoy Life Soft Baked Cookies Snickerdoodle","6.23","0.0","Market Basket","6 oz","6 oz","No Image.jpg","","6"
"4342","Meat & Seafood","Meat & Seafood Counter","Sausage","Deli","Deli Sliced Liverwurst","","Deli Sliced Liverwurst","5.59","0.0","Market Basket","1 lb","1 lb","No Image.jpg","","22"
"6416","Chips, Cookies & Snacks","Chips & Fruit Snacks","Rice Cake","Lundberg Family Farms","Lundberg Family Farms Organic Wild Rice Lightly Salted Whole Grain Rice Cakes","","Lundberg Family Farms Organic Wild Rice Lightly Salted Whole Grain Rice Cakes","3.74","0.0","Market Basket","8.5 oz","8.5 oz","No Image.jpg","","6"
"5246","Chips, Cookies & Snacks","Chips & Fruit Snacks","Chips & Pretzels","LATE JULY","LATE JULY Mild Green Mojo Tortilla Chips Organic","","LATE JULY Mild Green Mojo Tortilla Chips Organic","4.67","0.0","Market Basket","6 oz","6 oz","No Image.jpg","","0"
"6477","Chips, Cookies & Snacks","Nuts, Seeds & Dried Fruit","Nuts, Seeds & Dried Fruit","River Queen","River Queen Salted Fancy Mixed Nuts","","River Queen Salted Fancy Mixed Nuts","6.24","0.0","Market Basket","8 oz","8 oz","No Image.jpg","","6"
"5333","Breakfast & Dairy","Bars & Pastries","Breakfast Bars","Nature's Bakery","Nature's Bakery Oatmeal Crumble Strawberry","","Nature's Bakery Oatmeal Crumble Strawberry","4.69","0.0","Market Basket","6 x 1.41 oz","6 x 1.41 oz","No Image.jpg","","6"
"5331","Breakfast & Dairy","Bars & Pastries","Breakfast Bars","Nature's Bakery","Nature's Bakery Fig Bar Raspberry","","Nature's Bakery Fig Bar Raspberry","4.69","0.0","Market Basket","6 x 2 oz","6 x 2 oz","No Image.jpg","","6"
"5979","Beverages & Juices","Cocoa & Drink Mixes","Cocoa & Drink Mixes","Master of Mixes","Master of Mixes Triple Sec","","Master of Mixes Triple Sec","3.74","0.0","Market Basket","375 ml","375 ml","No Image.jpg","","17"
"6549","Chips, Cookies & Snacks","Nuts, Seeds & Dried Fruit","Nuts, Seeds & Dried Fruit","Next Organics","Next Organics Dried Mango","","Next Organics Dried Mango","5.61","0.0","Market Basket","4 oz","4 oz","No Image.jpg","","6"
"616","Laundry & Paper Goods","Paper Goods","Wipes","Puffs","Puffs Softly Eases Sneezes","","Puffs Softly Eases Sneezes","2.74","1.0","Market Basket","80 count","80 count","No Image.jpg","","14"
"560","Laundry & Paper Goods","Laundry","Laundry Detergent","Woolite","Woolite All Clothes Laundry Detergent 33 Loads","","Woolite All Clothes Laundry Detergent 33 Loads","12.49","1.0","Market Basket","50 fl oz","50 fl oz","No Image.jpg","","15"
"8747","Condiments & Dressings","Preserved Dips & Spreads","Preserved Dips & Salsa","Margarita's","Margarita's Hot Salsa","","Margarita's Hot Salsa","3.69","0.0","Market Basket","16 oz","16 oz","No Image.jpg","","1"
"5274","Chips, Cookies & Snacks","Chips & Fruit Snacks","Chips & Pretzels","Good Health","Good Health Sweet Potato Sea Salted Kettle Style Chips","","Good Health Sweet Potato Sea Salted Kettle Style Chips","4.69","0.0","Market Basket","5 oz","5 oz","No Image.jpg","","0"
"10661","Pasta & Sauces","Pasta Sauce","Pasta Sauce","Strega ","Strega Marinara Sauce","","Strega Marinara Sauce","4.89","0.0","Market Basket","26 oz","26 oz","No Image.jpg","","4"
"4377","Meat & Seafood","Meat & Seafood Counter","Turkey Thighs","Shady Brook Farms","Shady Brook Farms Turkey Thighs","","Shady Brook Farms Turkey Thighs","5.58","0.0","Market Basket","Approx: 2.00 lb at $2.79/lb","Approx: 2.00 lb at $2.79/lb","No Image.jpg","","22"
"5160","Chips, Cookies & Snacks","Cookies & Crackers","Crackers","Olde Cape Cod","Olde Cape Cod Oyster Crackers Multi-pack","","Olde Cape Cod Oyster Crackers Multi-pack","3.13","0.0","Market Basket","7.5 oz","7.5 oz","No Image.jpg","","6"
"5951","Beverages & Juices","Cocoa & Drink Mixes","Cocoa & Drink Mixes","Mr & Mrs T","Mr & Mrs T Pina Colada Mix","","Mr & Mrs T Pina Colada Mix","4.99","0.0","Market Basket","1 L","1 L","No Image.jpg","","17"
"5891","Beverages & Juices","Tea, Coffee, Milk & Coconut Water","Single To-Go Coffee","StarBucks","Starbucks Cold Brew Cocoa & Honey Flavored","","Starbucks Cold Brew Cocoa & Honey Flavored","3.74","0.0","Market Basket","11 fl oz","11 fl oz","No Image.jpg","","17"
"4051","Meat & Seafood","Meat & Seafood Counter","Beef","Certified Angus Beef","Certified Angus Beef Sirloin Tip Steaks USDA Choice","","Certified Angus Beef Sirloin Tip Steaks USDA Choice","14.98","0.0","Market Basket","1 lb","1 lb","No Image.jpg","","22"
"5359","Chips, Cookies & Snacks","Cookies & Crackers","Crackers","Nabisco","Nabisco Minions Teddy Grahams 12 Pack","","Nabisco Minions Teddy Grahams 12 Pack","6.23","0.0","Market Basket","12 x 1 oz","12 x 1 oz","No Image.jpg","","6"
"5334","Breakfast & Dairy","Bars & Pastries","Breakfast Bars","Nature's Bakery","Nature's Bakery Oatmeal Crumble Apple","","Nature's Bakery Oatmeal Crumble Apple","4.69","0.0","Market Basket","6 x 1.41 oz","6 x 1.41 oz","No Image.jpg","","6"
"5046","Chips, Cookies & Snacks","Cookies & Crackers","Cookies & Cakes","Famous Amos","Famous Amos Bite Size Chocolate Chip","","Famous Amos Bite Size Chocolate Chip","1.56","0.0","Market Basket","2.7 oz","2.7 oz","No Image.jpg","","6"
"5398","Chips, Cookies & Snacks","Cookies & Crackers","Crackers","Back to Nature","Back to Nature Classic Creme Cookies","","Back to Nature Classic Creme Cookies","6.23","0.0","Market Basket","12 oz","12 oz","No Image.jpg","","6"
